empresa,producto,sentimiento,comentario,fecha_hora
Coinbase,NFT platform,positivo,"Desde que uso NFT platform, soy más feliz. Gracias Coinbase! 😊",2025-04-20 08:00:00
Meta,Oculus Quest,neutral,Parece estable el Oculus Quest de Meta. Veremos con el tiempo.,2025-04-16 05:00:00
Nike,Jordan Retro,positivo,La mejor inversión que he hecho este año es Jordan Retro de Nike. 🔥,2025-04-19 02:00:00
Binance,Earn Program,negativo,El soporte de Binance no resolvió nada con mi Earn Program. 🤬,2025-04-16 03:00:00
Coinbase,Wallet,negativo,El Wallet de Coinbase no vale lo que cuesta. 😡,2025-04-15 08:00:00
Nvidia,RTX 4090,neutral,Vi muchas reseñas del RTX 4090 de Nvidia. Opiniones divididas.,2025-04-17 00:00:00
Nvidia,DLSS 3.5,neutral,Parece estable el DLSS 3.5 de Nvidia. Veremos con el tiempo.,2025-04-17 05:00:00
Binance,Smart Chain,neutral,"Smart Chain cumple con lo básico. Nada sorprendente, pero funciona.",2025-04-19 04:00:00
Tesla,Model 3,positivo,La mejor inversión que he hecho este año es Model 3 de Tesla. 🔥,2025-04-18 14:00:00
Nike,Nike Run Club,positivo,Muy satisfecho con Nike Run Club de Nike. No esperaba menos.,2025-04-17 07:00:00
Meta,Threads,neutral,Parece estable el Threads de Meta. Veremos con el tiempo.,2025-04-16 07:00:00
Coinbase,Coinbase Pro,positivo,¡Amo mi nuevo Coinbase Pro de Coinbase! 🥳,2025-04-18 11:00:00
Meta,Instagram,negativo,Nunca volveré a comprar un Instagram de Meta. Estafa total.,2025-04-15 16:00:00
Coinbase,NFT platform,positivo,"NFT platform me ha cambiado la vida. Gracias, Coinbase. ❤️",2025-04-19 08:00:00
Tesla,Autopilot,neutral,"Interesante propuesta con Autopilot de Tesla, veremos cómo evoluciona.",2025-04-18 02:00:00
Binance,Binance App,negativo,He tenido más problemas que beneficios con el Binance App de Binance.,2025-04-19 13:00:00
Coinbase,Wallet,negativo,Malísimo el Wallet de Coinbase. No lo recomiendo. 👎,2025-04-17 06:00:00
Tesla,Autopilot,neutral,"Autopilot cumple con lo básico. Nada sorprendente, pero funciona.",2025-04-18 20:00:00
Tesla,Model Y,neutral,Parece estable el Model Y de Tesla. Veremos con el tiempo.,2025-04-19 09:00:00
Meta,Facebook Ads,positivo,El servicio de Meta con Facebook Ads fue impecable. 10/10 ⭐,2025-04-16 16:00:00
Nvidia,GeForce NOW,negativo,Otro día más batallando con GeForce NOW de Nvidia.,2025-04-15 10:00:00
Coinbase,NFT platform,positivo,Nunca pensé que NFT platform de Coinbase fuera tan bueno. Sorprendido. 👍,2025-04-15 10:00:00
Apple,Apple Watch,neutral,No tengo quejas ni elogios del Apple Watch de Apple.,2025-04-18 11:00:00
Nike,Nike App,positivo,"Nike App me ha cambiado la vida. Gracias, Nike. ❤️",2025-04-18 20:00:00
Coinbase,NFT platform,neutral,Vi muchas reseñas del NFT platform de Coinbase. Opiniones divididas.,2025-04-16 16:00:00
Coinbase,NFT platform,negativo,"Coinbase, ¿qué les pasó con el NFT platform? Está lleno de fallas. 😤",2025-04-17 15:00:00
Nvidia,RTX 4090,positivo,La mejor inversión que he hecho este año es RTX 4090 de Nvidia. 🔥,2025-04-17 07:00:00
Binance,Launchpad,positivo,El servicio de Binance con Launchpad fue impecable. 10/10 ⭐,2025-04-15 15:00:00
Apple,MacBook Air,neutral,Probando el MacBook Air de Apple. Aún no sé qué pensar.,2025-04-18 21:00:00
Coinbase,Coinbase Pro,negativo,"Ya van 3 veces que falla el Coinbase Pro. ¿Qué pasa, Coinbase?",2025-04-16 14:00:00
Nike,Jordan Retro,negativo,"Jordan Retro no sirve para nada, Nike debería hacer recall ya.",2025-04-16 03:00:00
Coinbase,Wallet,neutral,"Interesante propuesta con Wallet de Coinbase, veremos cómo evoluciona.",2025-04-15 10:00:00
Nvidia,CUDA Toolkit,negativo,"CUDA Toolkit no sirve para nada, Nvidia debería hacer recall ya.",2025-04-17 03:00:00
Apple,Apple Watch,neutral,Probando el Apple Watch de Apple. Aún no sé qué pensar.,2025-04-20 07:00:00
Nike,Nike App,neutral,Parece estable el Nike App de Nike. Veremos con el tiempo.,2025-04-18 06:00:00
Coinbase,NFT platform,neutral,"Es un NFT platform más. No está mal, pero tampoco es la gran cosa.",2025-04-18 00:00:00
Nvidia,GeForce NOW,neutral,No entiendo el hype con el GeForce NOW de Nvidia. Meh.,2025-04-17 21:00:00
Binance,Launchpad,negativo,Otro día más batallando con Launchpad de Binance.,2025-04-16 01:00:00
Nike,Jordan Retro,negativo,Nunca volveré a comprar un Jordan Retro de Nike. Estafa total.,2025-04-18 08:00:00
Nike,Jordan Retro,negativo,"Ya van 3 veces que falla el Jordan Retro. ¿Qué pasa, Nike?",2025-04-16 12:00:00
Nvidia,RTX 4090,negativo,He tenido más problemas que beneficios con el RTX 4090 de Nvidia.,2025-04-19 02:00:00
Coinbase,Coinbase Pro,negativo,Nunca volveré a comprar un Coinbase Pro de Coinbase. Estafa total.,2025-04-15 19:00:00
Binance,Smart Chain,negativo,Tuve una pésima experiencia con Smart Chain de Binance. Decepcionante. 👎,2025-04-15 13:00:00
Nike,Nike App,neutral,"Interesante propuesta con Nike App de Nike, veremos cómo evoluciona.",2025-04-17 23:00:00
Binance,Earn Program,positivo,¡Amo mi nuevo Earn Program de Binance! 🥳,2025-04-18 09:00:00
Nike,Nike Run Club,neutral,Parece estable el Nike Run Club de Nike. Veremos con el tiempo.,2025-04-19 01:00:00
Meta,Instagram,positivo,Muy satisfecho con Instagram de Meta. No esperaba menos.,2025-04-17 17:00:00
Tesla,Model Y,negativo,"Tesla, ¿qué les pasó con el Model Y? Está lleno de fallas. 😤",2025-04-15 17:00:00
Nvidia,DLSS 3.5,neutral,El DLSS 3.5 de Nvidia es... aceptable.,2025-04-16 07:00:00
Meta,Facebook Ads,neutral,"Facebook Ads cumple con lo básico. Nada sorprendente, pero funciona.",2025-04-19 02:00:00
Apple,MacBook Air,positivo,"Desde que uso MacBook Air, soy más feliz. Gracias Apple! 😊",2025-04-20 04:00:00
Nike,Nike Run Club,neutral,"Es un Nike Run Club más. No está mal, pero tampoco es la gran cosa.",2025-04-15 20:00:00
Coinbase,Earn,negativo,"Earn no sirve para nada, Coinbase debería hacer recall ya.",2025-04-19 00:00:00
Tesla,Powerwall,positivo,"Powerwall me ha cambiado la vida. Gracias, Tesla. ❤️",2025-04-15 15:00:00
Coinbase,Earn,negativo,Tuve una pésima experiencia con Earn de Coinbase. Decepcionante. 👎,2025-04-16 14:00:00
Tesla,Model 3,positivo,La mejor inversión que he hecho este año es Model 3 de Tesla. 🔥,2025-04-16 22:00:00
Binance,Smart Chain,negativo,Otro día más batallando con Smart Chain de Binance.,2025-04-16 23:00:00
Meta,Instagram,positivo,"Instagram me ha cambiado la vida. Gracias, Meta. ❤️",2025-04-16 04:00:00
Binance,Binance App,positivo,"Desde que uso Binance App, soy más feliz. Gracias Binance! 😊",2025-04-16 22:00:00
Binance,Smart Chain,negativo,Tuve una pésima experiencia con Smart Chain de Binance. Decepcionante. 👎,2025-04-16 23:00:00
Apple,iOS 18,positivo,Muy satisfecho con iOS 18 de Apple. No esperaba menos.,2025-04-18 18:00:00
Meta,Instagram,positivo,No puedo creer lo bien que funciona el Instagram de Meta. Recomendado. 💯,2025-04-16 16:00:00
Nike,Air Max,neutral,Probando el Air Max de Nike. Aún no sé qué pensar.,2025-04-16 16:00:00
Nike,Nike App,neutral,"Es un Nike App más. No está mal, pero tampoco es la gran cosa.",2025-04-16 15:00:00
Coinbase,Coinbase Pro,neutral,No entiendo el hype con el Coinbase Pro de Coinbase. Meh.,2025-04-18 15:00:00
Tesla,Model 3,neutral,No tengo quejas ni elogios del Model 3 de Tesla.,2025-04-16 16:00:00
Nike,Jordan Retro,neutral,No entiendo el hype con el Jordan Retro de Nike. Meh.,2025-04-17 15:00:00
Meta,Threads,positivo,"Threads me ha cambiado la vida. Gracias, Meta. ❤️",2025-04-17 21:00:00
Apple,MacBook Air,negativo,"Ya van 3 veces que falla el MacBook Air. ¿Qué pasa, Apple?",2025-04-18 06:00:00
Apple,Apple Watch,positivo,"Apple se la rifó con el Apple Watch, está brutal 😍",2025-04-16 07:00:00
Nvidia,GeForce NOW,positivo,¡Amo mi nuevo GeForce NOW de Nvidia! 🥳,2025-04-19 10:00:00
Apple,Apple Watch,neutral,"Interesante propuesta con Apple Watch de Apple, veremos cómo evoluciona.",2025-04-15 10:00:00
Tesla,Model 3,negativo,El Model 3 de Tesla no vale lo que cuesta. 😡,2025-04-19 00:00:00
Apple,iPhone 15,neutral,El iPhone 15 de Apple es... aceptable.,2025-04-19 02:00:00
Nvidia,GeForce NOW,positivo,¡Amo mi nuevo GeForce NOW de Nvidia! 🥳,2025-04-18 11:00:00
Coinbase,NFT platform,positivo,"Desde que uso NFT platform, soy más feliz. Gracias Coinbase! 😊",2025-04-19 07:00:00
Apple,iPhone 15,positivo,"iPhone 15 me ha cambiado la vida. Gracias, Apple. ❤️",2025-04-17 17:00:00
Meta,Instagram,negativo,"Ya van 3 veces que falla el Instagram. ¿Qué pasa, Meta?",2025-04-18 10:00:00
Nvidia,RTX 4090,negativo,El RTX 4090 de Nvidia no vale lo que cuesta. 😡,2025-04-16 23:00:00
Apple,iOS 18,neutral,Apple lanzó el nuevo iOS 18. Alguien ya lo probó?,2025-04-19 14:00:00
Nvidia,GeForce NOW,positivo,"Desde que uso GeForce NOW, soy más feliz. Gracias Nvidia! 😊",2025-04-18 12:00:00
Coinbase,Earn,neutral,"Earn cumple con lo básico. Nada sorprendente, pero funciona.",2025-04-16 04:00:00
Nvidia,GeForce NOW,negativo,El GeForce NOW de Nvidia no vale lo que cuesta. 😡,2025-04-20 07:00:00
Nvidia,CUDA Toolkit,negativo,El soporte de Nvidia no resolvió nada con mi CUDA Toolkit. 🤬,2025-04-17 21:00:00
Nvidia,RTX 4090,positivo,No puedo creer lo bien que funciona el RTX 4090 de Nvidia. Recomendado. 💯,2025-04-15 14:00:00
Coinbase,Wallet,positivo,El servicio de Coinbase con Wallet fue impecable. 10/10 ⭐,2025-04-16 19:00:00
Tesla,Autopilot,positivo,Lo de Tesla con el Autopilot es otro nivel. 😎,2025-04-17 00:00:00
Apple,Apple Watch,positivo,Muy satisfecho con Apple Watch de Apple. No esperaba menos.,2025-04-18 17:00:00
Nvidia,GeForce NOW,neutral,"GeForce NOW cumple con lo básico. Nada sorprendente, pero funciona.",2025-04-16 19:00:00
Binance,Launchpad,negativo,Tuve una pésima experiencia con Launchpad de Binance. Decepcionante. 👎,2025-04-15 12:00:00
Nike,Nike Run Club,negativo,"Nike, ¿qué les pasó con el Nike Run Club? Está lleno de fallas. 😤",2025-04-16 13:00:00
Apple,iOS 18,neutral,Probando el iOS 18 de Apple. Aún no sé qué pensar.,2025-04-17 03:00:00
Apple,iPhone 15,positivo,No puedo creer lo bien que funciona el iPhone 15 de Apple. Recomendado. 💯,2025-04-15 13:00:00
Coinbase,Earn,neutral,No entiendo el hype con el Earn de Coinbase. Meh.,2025-04-16 18:00:00
Binance,Earn Program,positivo,Lo de Binance con el Earn Program es otro nivel. 😎,2025-04-20 04:00:00
Apple,iPhone 15,negativo,El iPhone 15 de Apple no vale lo que cuesta. 😡,2025-04-19 21:00:00
Apple,MacBook Air,positivo,El servicio de Apple con MacBook Air fue impecable. 10/10 ⭐,2025-04-20 00:00:00
Binance,Launchpad,neutral,No entiendo el hype con el Launchpad de Binance. Meh.,2025-04-20 05:00:00
Coinbase,Earn,neutral,No tengo quejas ni elogios del Earn de Coinbase.,2025-04-17 08:00:00
Nike,Air Max,negativo,Malísimo el Air Max de Nike. No lo recomiendo. 👎,2025-04-16 07:00:00
Meta,Instagram,negativo,Malísimo el Instagram de Meta. No lo recomiendo. 👎,2025-04-20 08:00:00
Apple,iPhone 15,neutral,"Interesante propuesta con iPhone 15 de Apple, veremos cómo evoluciona.",2025-04-19 23:00:00
Meta,Facebook Ads,positivo,¡Amo mi nuevo Facebook Ads de Meta! 🥳,2025-04-16 05:00:00
Nvidia,CUDA Toolkit,positivo,El servicio de Nvidia con CUDA Toolkit fue impecable. 10/10 ⭐,2025-04-15 18:00:00
Tesla,Model Y,positivo,La mejor inversión que he hecho este año es Model Y de Tesla. 🔥,2025-04-15 11:00:00
Nvidia,DLSS 3.5,neutral,No tengo quejas ni elogios del DLSS 3.5 de Nvidia.,2025-04-18 19:00:00
Coinbase,Wallet,neutral,Probando el Wallet de Coinbase. Aún no sé qué pensar.,2025-04-18 02:00:00
Apple,iOS 18,negativo,Malísimo el iOS 18 de Apple. No lo recomiendo. 👎,2025-04-19 19:00:00
Coinbase,Coinbase Pro,neutral,Probando el Coinbase Pro de Coinbase. Aún no sé qué pensar.,2025-04-15 21:00:00
Tesla,Powerwall,positivo,No puedo creer lo bien que funciona el Powerwall de Tesla. Recomendado. 💯,2025-04-18 19:00:00
Nike,Air Max,neutral,Probando el Air Max de Nike. Aún no sé qué pensar.,2025-04-19 01:00:00
Apple,iOS 18,neutral,Probando el iOS 18 de Apple. Aún no sé qué pensar.,2025-04-15 23:00:00
Coinbase,Earn,positivo,La mejor inversión que he hecho este año es Earn de Coinbase. 🔥,2025-04-17 06:00:00
Coinbase,Earn,positivo,"Coinbase se la rifó con el Earn, está brutal 😍",2025-04-15 08:00:00
Tesla,Autopilot,negativo,El soporte de Tesla no resolvió nada con mi Autopilot. 🤬,2025-04-17 16:00:00
Nike,Air Max,negativo,"Air Max no sirve para nada, Nike debería hacer recall ya.",2025-04-17 16:00:00
Nvidia,GeForce NOW,positivo,La mejor inversión que he hecho este año es GeForce NOW de Nvidia. 🔥,2025-04-16 03:00:00
Meta,Instagram,negativo,Otro día más batallando con Instagram de Meta.,2025-04-16 13:00:00
Coinbase,Earn,negativo,"Ya van 3 veces que falla el Earn. ¿Qué pasa, Coinbase?",2025-04-19 09:00:00
Nike,Nike Run Club,negativo,"Ya van 3 veces que falla el Nike Run Club. ¿Qué pasa, Nike?",2025-04-18 13:00:00
Tesla,Model Y,neutral,Vi muchas reseñas del Model Y de Tesla. Opiniones divididas.,2025-04-16 16:00:00
Nike,Air Max,negativo,El Air Max de Nike no vale lo que cuesta. 😡,2025-04-19 14:00:00
Nike,Jordan Retro,neutral,No entiendo el hype con el Jordan Retro de Nike. Meh.,2025-04-17 00:00:00
Apple,iOS 18,positivo,No puedo creer lo bien que funciona el iOS 18 de Apple. Recomendado. 💯,2025-04-15 23:00:00
Binance,Binance App,negativo,Tuve una pésima experiencia con Binance App de Binance. Decepcionante. 👎,2025-04-17 09:00:00
Meta,Oculus Quest,neutral,El Oculus Quest de Meta es... aceptable.,2025-04-20 03:00:00
Binance,Binance App,negativo,"Binance App no sirve para nada, Binance debería hacer recall ya.",2025-04-16 05:00:00
Coinbase,Wallet,neutral,Probando el Wallet de Coinbase. Aún no sé qué pensar.,2025-04-18 05:00:00
Meta,Instagram,negativo,Otro día más batallando con Instagram de Meta.,2025-04-17 17:00:00
Nvidia,CUDA Toolkit,negativo,He tenido más problemas que beneficios con el CUDA Toolkit de Nvidia.,2025-04-17 18:00:00
Meta,Threads,neutral,"Threads cumple con lo básico. Nada sorprendente, pero funciona.",2025-04-19 05:00:00
Tesla,Model Y,negativo,El soporte de Tesla no resolvió nada con mi Model Y. 🤬,2025-04-17 09:00:00
Nike,Jordan Retro,neutral,No entiendo el hype con el Jordan Retro de Nike. Meh.,2025-04-18 00:00:00
Nike,Nike App,neutral,"Nike App cumple con lo básico. Nada sorprendente, pero funciona.",2025-04-16 09:00:00
Nike,Jordan Retro,positivo,¡Amo mi nuevo Jordan Retro de Nike! 🥳,2025-04-18 12:00:00
Nvidia,GeForce NOW,positivo,El servicio de Nvidia con GeForce NOW fue impecable. 10/10 ⭐,2025-04-18 20:00:00
Meta,Threads,neutral,El Threads de Meta es... aceptable.,2025-04-20 02:00:00
Nvidia,CUDA Toolkit,negativo,He tenido más problemas que beneficios con el CUDA Toolkit de Nvidia.,2025-04-17 21:00:00
Meta,Instagram,neutral,Meta lanzó el nuevo Instagram. Alguien ya lo probó?,2025-04-17 23:00:00
Coinbase,Earn,positivo,No puedo creer lo bien que funciona el Earn de Coinbase. Recomendado. 💯,2025-04-18 13:00:00
Binance,Smart Chain,neutral,No tengo quejas ni elogios del Smart Chain de Binance.,2025-04-15 20:00:00
Binance,Launchpad,positivo,¡Amo mi nuevo Launchpad de Binance! 🥳,2025-04-15 14:00:00
Coinbase,NFT platform,positivo,"NFT platform me ha cambiado la vida. Gracias, Coinbase. ❤️",2025-04-18 07:00:00
Meta,Facebook Ads,neutral,No tengo quejas ni elogios del Facebook Ads de Meta.,2025-04-18 03:00:00
Nvidia,RTX 4090,neutral,El RTX 4090 de Nvidia es... aceptable.,2025-04-20 05:00:00
Coinbase,Earn,neutral,Parece estable el Earn de Coinbase. Veremos con el tiempo.,2025-04-17 20:00:00
Coinbase,Wallet,neutral,Vi muchas reseñas del Wallet de Coinbase. Opiniones divididas.,2025-04-17 11:00:00
Nike,Nike Run Club,neutral,No entiendo el hype con el Nike Run Club de Nike. Meh.,2025-04-20 04:00:00
Binance,Binance App,positivo,Muy satisfecho con Binance App de Binance. No esperaba menos.,2025-04-19 00:00:00
Coinbase,Coinbase Pro,neutral,"Interesante propuesta con Coinbase Pro de Coinbase, veremos cómo evoluciona.",2025-04-15 14:00:00
Apple,MacBook Air,negativo,"MacBook Air no sirve para nada, Apple debería hacer recall ya.",2025-04-19 07:00:00
Tesla,Model 3,positivo,"Model 3 me ha cambiado la vida. Gracias, Tesla. ❤️",2025-04-20 05:00:00
Tesla,Autopilot,negativo,Otro día más batallando con Autopilot de Tesla.,2025-04-19 07:00:00
Tesla,Model 3,negativo,El Model 3 de Tesla no vale lo que cuesta. 😡,2025-04-18 05:00:00
Binance,Earn Program,neutral,"Interesante propuesta con Earn Program de Binance, veremos cómo evoluciona.",2025-04-18 19:00:00
Nike,Jordan Retro,positivo,Muy satisfecho con Jordan Retro de Nike. No esperaba menos.,2025-04-15 13:00:00
Apple,MacBook Air,negativo,Nunca volveré a comprar un MacBook Air de Apple. Estafa total.,2025-04-19 14:00:00
Nvidia,DLSS 3.5,neutral,Probando el DLSS 3.5 de Nvidia. Aún no sé qué pensar.,2025-04-16 17:00:00
Coinbase,Coinbase Pro,positivo,"Coinbase se la rifó con el Coinbase Pro, está brutal 😍",2025-04-17 23:00:00
Coinbase,Coinbase Pro,negativo,"Coinbase, ¿qué les pasó con el Coinbase Pro? Está lleno de fallas. 😤",2025-04-16 01:00:00
Tesla,Autopilot,neutral,"Interesante propuesta con Autopilot de Tesla, veremos cómo evoluciona.",2025-04-17 15:00:00
Nvidia,GeForce NOW,positivo,No puedo creer lo bien que funciona el GeForce NOW de Nvidia. Recomendado. 💯,2025-04-16 02:00:00
Apple,iOS 18,positivo,"iOS 18 me ha cambiado la vida. Gracias, Apple. ❤️",2025-04-18 20:00:00
Nike,Nike Run Club,positivo,No puedo creer lo bien que funciona el Nike Run Club de Nike. Recomendado. 💯,2025-04-18 06:00:00
Coinbase,Coinbase Pro,negativo,El Coinbase Pro de Coinbase no vale lo que cuesta. 😡,2025-04-18 02:00:00
Binance,Binance App,negativo,"Binance App no sirve para nada, Binance debería hacer recall ya.",2025-04-16 15:00:00
Apple,iOS 18,positivo,La mejor inversión que he hecho este año es iOS 18 de Apple. 🔥,2025-04-15 18:00:00
Meta,Threads,negativo,He tenido más problemas que beneficios con el Threads de Meta.,2025-04-17 13:00:00
Coinbase,Wallet,neutral,El Wallet de Coinbase es... aceptable.,2025-04-18 20:00:00
Meta,Threads,negativo,Malísimo el Threads de Meta. No lo recomiendo. 👎,2025-04-16 15:00:00
Nike,Nike App,neutral,"Interesante propuesta con Nike App de Nike, veremos cómo evoluciona.",2025-04-15 14:00:00
Coinbase,NFT platform,positivo,No puedo creer lo bien que funciona el NFT platform de Coinbase. Recomendado. 💯,2025-04-18 02:00:00
Tesla,Model Y,positivo,Nunca pensé que Model Y de Tesla fuera tan bueno. Sorprendido. 👍,2025-04-17 21:00:00
Binance,Earn Program,neutral,No entiendo el hype con el Earn Program de Binance. Meh.,2025-04-19 16:00:00
Meta,Facebook Ads,positivo,No puedo creer lo bien que funciona el Facebook Ads de Meta. Recomendado. 💯,2025-04-19 13:00:00
Nike,Air Max,neutral,El Air Max de Nike es... aceptable.,2025-04-16 11:00:00
Apple,Apple Watch,negativo,Nunca volveré a comprar un Apple Watch de Apple. Estafa total.,2025-04-17 08:00:00
Tesla,Powerwall,positivo,La mejor inversión que he hecho este año es Powerwall de Tesla. 🔥,2025-04-19 12:00:00
Coinbase,Earn,neutral,No tengo quejas ni elogios del Earn de Coinbase.,2025-04-16 09:00:00
Binance,Earn Program,negativo,Malísimo el Earn Program de Binance. No lo recomiendo. 👎,2025-04-18 15:00:00
Tesla,Autopilot,negativo,El soporte de Tesla no resolvió nada con mi Autopilot. 🤬,2025-04-15 14:00:00
Nvidia,DLSS 3.5,positivo,Lo de Nvidia con el DLSS 3.5 es otro nivel. 😎,2025-04-18 20:00:00
Tesla,Powerwall,positivo,"Powerwall me ha cambiado la vida. Gracias, Tesla. ❤️",2025-04-20 00:00:00
Meta,Facebook Ads,negativo,El soporte de Meta no resolvió nada con mi Facebook Ads. 🤬,2025-04-17 09:00:00
Apple,iPhone 15,neutral,Apple lanzó el nuevo iPhone 15. Alguien ya lo probó?,2025-04-15 10:00:00
Apple,Apple Watch,positivo,"Apple se la rifó con el Apple Watch, está brutal 😍",2025-04-17 00:00:00
Coinbase,NFT platform,neutral,No entiendo el hype con el NFT platform de Coinbase. Meh.,2025-04-15 14:00:00
Tesla,Autopilot,neutral,No tengo quejas ni elogios del Autopilot de Tesla.,2025-04-19 00:00:00
Binance,Earn Program,neutral,No entiendo el hype con el Earn Program de Binance. Meh.,2025-04-19 02:00:00
Apple,MacBook Air,neutral,"Interesante propuesta con MacBook Air de Apple, veremos cómo evoluciona.",2025-04-19 19:00:00
Nvidia,DLSS 3.5,neutral,No entiendo el hype con el DLSS 3.5 de Nvidia. Meh.,2025-04-15 12:00:00
Tesla,Powerwall,neutral,Tesla lanzó el nuevo Powerwall. Alguien ya lo probó?,2025-04-18 21:00:00
Nike,Nike App,neutral,"Es un Nike App más. No está mal, pero tampoco es la gran cosa.",2025-04-19 23:00:00
Nike,Nike Run Club,negativo,Nunca volveré a comprar un Nike Run Club de Nike. Estafa total.,2025-04-17 22:00:00
Apple,Apple Watch,neutral,Vi muchas reseñas del Apple Watch de Apple. Opiniones divididas.,2025-04-16 14:00:00
Coinbase,Earn,positivo,No puedo creer lo bien que funciona el Earn de Coinbase. Recomendado. 💯,2025-04-18 10:00:00
Meta,Oculus Quest,positivo,La mejor inversión que he hecho este año es Oculus Quest de Meta. 🔥,2025-04-19 02:00:00
Nike,Nike App,negativo,He tenido más problemas que beneficios con el Nike App de Nike.,2025-04-15 09:00:00
Binance,Earn Program,positivo,El servicio de Binance con Earn Program fue impecable. 10/10 ⭐,2025-04-18 16:00:00
Tesla,Autopilot,positivo,¡Amo mi nuevo Autopilot de Tesla! 🥳,2025-04-16 00:00:00
Apple,MacBook Air,positivo,Lo de Apple con el MacBook Air es otro nivel. 😎,2025-04-19 09:00:00
Binance,Launchpad,neutral,No tengo quejas ni elogios del Launchpad de Binance.,2025-04-17 02:00:00
Coinbase,Coinbase Pro,positivo,La mejor inversión que he hecho este año es Coinbase Pro de Coinbase. 🔥,2025-04-17 21:00:00
Nvidia,DLSS 3.5,neutral,El DLSS 3.5 de Nvidia es... aceptable.,2025-04-15 22:00:00
Apple,Apple Watch,neutral,"Apple Watch cumple con lo básico. Nada sorprendente, pero funciona.",2025-04-19 13:00:00
Binance,Smart Chain,neutral,"Smart Chain cumple con lo básico. Nada sorprendente, pero funciona.",2025-04-15 14:00:00
Meta,Threads,positivo,¡Amo mi nuevo Threads de Meta! 🥳,2025-04-19 05:00:00
Apple,iPhone 15,positivo,"Apple se la rifó con el iPhone 15, está brutal 😍",2025-04-16 12:00:00
Nike,Nike App,negativo,"Nike App no sirve para nada, Nike debería hacer recall ya.",2025-04-20 00:00:00
Nvidia,GeForce NOW,negativo,"Nvidia, ¿qué les pasó con el GeForce NOW? Está lleno de fallas. 😤",2025-04-19 22:00:00
Binance,Earn Program,positivo,"Binance se la rifó con el Earn Program, está brutal 😍",2025-04-17 11:00:00
Apple,iOS 18,neutral,"iOS 18 cumple con lo básico. Nada sorprendente, pero funciona.",2025-04-18 00:00:00
Nvidia,CUDA Toolkit,positivo,La mejor inversión que he hecho este año es CUDA Toolkit de Nvidia. 🔥,2025-04-18 18:00:00
Tesla,Model 3,negativo,El Model 3 de Tesla no vale lo que cuesta. 😡,2025-04-19 17:00:00
Meta,Threads,positivo,No puedo creer lo bien que funciona el Threads de Meta. Recomendado. 💯,2025-04-18 01:00:00
Apple,iPhone 15,positivo,Lo de Apple con el iPhone 15 es otro nivel. 😎,2025-04-18 21:00:00
Nvidia,RTX 4090,positivo,"Nvidia se la rifó con el RTX 4090, está brutal 😍",2025-04-19 08:00:00
Nike,Jordan Retro,negativo,"Nike, ¿qué les pasó con el Jordan Retro? Está lleno de fallas. 😤",2025-04-16 17:00:00
Apple,Apple Watch,neutral,"Interesante propuesta con Apple Watch de Apple, veremos cómo evoluciona.",2025-04-19 17:00:00
Meta,Instagram,negativo,"Ya van 3 veces que falla el Instagram. ¿Qué pasa, Meta?",2025-04-17 10:00:00
Coinbase,Earn,positivo,Lo de Coinbase con el Earn es otro nivel. 😎,2025-04-18 02:00:00
Binance,Earn Program,negativo,Nunca volveré a comprar un Earn Program de Binance. Estafa total.,2025-04-16 02:00:00
Meta,Threads,negativo,"Meta, ¿qué les pasó con el Threads? Está lleno de fallas. 😤",2025-04-17 12:00:00
Nike,Nike Run Club,neutral,Parece estable el Nike Run Club de Nike. Veremos con el tiempo.,2025-04-15 16:00:00
Nike,Nike App,neutral,Probando el Nike App de Nike. Aún no sé qué pensar.,2025-04-18 19:00:00
Apple,iOS 18,negativo,Tuve una pésima experiencia con iOS 18 de Apple. Decepcionante. 👎,2025-04-16 14:00:00
Apple,Apple Watch,negativo,Nunca volveré a comprar un Apple Watch de Apple. Estafa total.,2025-04-16 13:00:00
Binance,Earn Program,positivo,El servicio de Binance con Earn Program fue impecable. 10/10 ⭐,2025-04-18 10:00:00
Apple,MacBook Air,positivo,Muy satisfecho con MacBook Air de Apple. No esperaba menos.,2025-04-19 22:00:00
Binance,Binance App,neutral,"Es un Binance App más. No está mal, pero tampoco es la gran cosa.",2025-04-15 23:00:00
Coinbase,Wallet,negativo,El soporte de Coinbase no resolvió nada con mi Wallet. 🤬,2025-04-15 12:00:00
Binance,Binance App,neutral,Probando el Binance App de Binance. Aún no sé qué pensar.,2025-04-17 22:00:00
Nvidia,RTX 4090,negativo,He tenido más problemas que beneficios con el RTX 4090 de Nvidia.,2025-04-15 14:00:00
Meta,Threads,neutral,"Interesante propuesta con Threads de Meta, veremos cómo evoluciona.",2025-04-19 17:00:00
Apple,MacBook Air,negativo,He tenido más problemas que beneficios con el MacBook Air de Apple.,2025-04-16 06:00:00
Apple,iPhone 15,neutral,No entiendo el hype con el iPhone 15 de Apple. Meh.,2025-04-16 07:00:00
Nvidia,GeForce NOW,negativo,He tenido más problemas que beneficios con el GeForce NOW de Nvidia.,2025-04-18 22:00:00
Nike,Nike App,negativo,Otro día más batallando con Nike App de Nike.,2025-04-17 00:00:00
Nike,Nike Run Club,neutral,"Nike Run Club cumple con lo básico. Nada sorprendente, pero funciona.",2025-04-16 08:00:00
Nike,Nike Run Club,positivo,Muy satisfecho con Nike Run Club de Nike. No esperaba menos.,2025-04-19 10:00:00
Coinbase,Coinbase Pro,neutral,Vi muchas reseñas del Coinbase Pro de Coinbase. Opiniones divididas.,2025-04-19 03:00:00
Nike,Nike Run Club,neutral,Probando el Nike Run Club de Nike. Aún no sé qué pensar.,2025-04-16 11:00:00
