empresa,producto,sentimiento,comentario,fecha_hora
Apple,MacBook Air,neutral,"MacBook Air cumple con lo básico. Nada sorprendente, pero funciona.",2025-04-16 13:00:00
Apple,MacBook Air,negativo,He tenido más problemas que beneficios con el MacBook Air de Apple.,2025-04-19 11:00:00
Nvidia,GeForce NOW,negativo,Malísimo el GeForce NOW de Nvidia. No lo recomiendo. 👎,2025-04-16 23:00:00
Nike,Air Max,neutral,Vi muchas reseñas del Air Max de Nike. Opiniones divididas.,2025-04-19 08:00:00
Apple,MacBook Air,positivo,No puedo creer lo bien que funciona el MacBook Air de Apple. Recomendado. 💯,2025-04-16 17:00:00
Nike,Jordan Retro,negativo,"Ya van 3 veces que falla el Jordan Retro. ¿Qué pasa, Nike?",2025-04-17 06:00:00
Coinbase,Earn,negativo,"Ya van 3 veces que falla el Earn. ¿Qué pasa, Coinbase?",2025-04-18 13:00:00
Meta,Threads,negativo,"Meta, ¿qué les pasó con el Threads? Está lleno de fallas. 😤",2025-04-20 02:00:00
Coinbase,Earn,positivo,"Coinbase se la rifó con el Earn, está brutal 😍",2025-04-17 20:00:00
Meta,Threads,positivo,La mejor inversión que he hecho este año es Threads de Meta. 🔥,2025-04-19 07:00:00
Nvidia,DLSS 3.5,negativo,El DLSS 3.5 de Nvidia no vale lo que cuesta. 😡,2025-04-18 13:00:00
Binance,Binance App,positivo,No puedo creer lo bien que funciona el Binance App de Binance. Recomendado. 💯,2025-04-16 10:00:00
Binance,Launchpad,positivo,"Binance se la rifó con el Launchpad, está brutal 😍",2025-04-18 22:00:00
Meta,Facebook Ads,negativo,Nunca volveré a comprar un Facebook Ads de Meta. Estafa total.,2025-04-15 09:00:00
Meta,Oculus Quest,positivo,"Desde que uso Oculus Quest, soy más feliz. Gracias Meta! 😊",2025-04-17 17:00:00
Nvidia,RTX 4090,negativo,Nunca volveré a comprar un RTX 4090 de Nvidia. Estafa total.,2025-04-16 12:00:00
Meta,Oculus Quest,negativo,El soporte de Meta no resolvió nada con mi Oculus Quest. 🤬,2025-04-20 06:00:00
Nvidia,CUDA Toolkit,negativo,Tuve una pésima experiencia con CUDA Toolkit de Nvidia. Decepcionante. 👎,2025-04-19 11:00:00
Binance,Launchpad,neutral,No tengo quejas ni elogios del Launchpad de Binance.,2025-04-17 06:00:00
Binance,Smart Chain,negativo,El soporte de Binance no resolvió nada con mi Smart Chain. 🤬,2025-04-18 07:00:00
Coinbase,Coinbase Pro,positivo,¡Amo mi nuevo Coinbase Pro de Coinbase! 🥳,2025-04-20 08:00:00
Apple,Apple Watch,negativo,Malísimo el Apple Watch de Apple. No lo recomiendo. 👎,2025-04-19 23:00:00
Nvidia,CUDA Toolkit,negativo,He tenido más problemas que beneficios con el CUDA Toolkit de Nvidia.,2025-04-18 23:00:00
Binance,Earn Program,neutral,"Es un Earn Program más. No está mal, pero tampoco es la gran cosa.",2025-04-17 15:00:00
Nike,Air Max,neutral,No entiendo el hype con el Air Max de Nike. Meh.,2025-04-18 11:00:00
Apple,iPhone 15,positivo,Lo de Apple con el iPhone 15 es otro nivel. 😎,2025-04-16 07:00:00
Nvidia,DLSS 3.5,positivo,"DLSS 3.5 me ha cambiado la vida. Gracias, Nvidia. ❤️",2025-04-18 05:00:00
Nvidia,DLSS 3.5,negativo,"Nvidia, ¿qué les pasó con el DLSS 3.5? Está lleno de fallas. 😤",2025-04-19 06:00:00
Nvidia,RTX 4090,negativo,Tuve una pésima experiencia con RTX 4090 de Nvidia. Decepcionante. 👎,2025-04-19 07:00:00
Tesla,Powerwall,negativo,El soporte de Tesla no resolvió nada con mi Powerwall. 🤬,2025-04-16 07:00:00
Nvidia,CUDA Toolkit,neutral,Nvidia lanzó el nuevo CUDA Toolkit. Alguien ya lo probó?,2025-04-16 10:00:00
Nike,Nike App,positivo,Nunca pensé que Nike App de Nike fuera tan bueno. Sorprendido. 👍,2025-04-18 03:00:00
Binance,Launchpad,neutral,Probando el Launchpad de Binance. Aún no sé qué pensar.,2025-04-16 23:00:00
Coinbase,Wallet,negativo,El soporte de Coinbase no resolvió nada con mi Wallet. 🤬,2025-04-17 14:00:00
Tesla,Autopilot,neutral,No entiendo el hype con el Autopilot de Tesla. Meh.,2025-04-20 08:00:00
Coinbase,Coinbase Pro,positivo,"Coinbase Pro me ha cambiado la vida. Gracias, Coinbase. ❤️",2025-04-16 14:00:00
Coinbase,Wallet,positivo,El servicio de Coinbase con Wallet fue impecable. 10/10 ⭐,2025-04-17 16:00:00
Tesla,Model 3,neutral,Probando el Model 3 de Tesla. Aún no sé qué pensar.,2025-04-16 19:00:00
Nvidia,CUDA Toolkit,positivo,"Nvidia se la rifó con el CUDA Toolkit, está brutal 😍",2025-04-20 08:00:00
Coinbase,NFT platform,negativo,"NFT platform no sirve para nada, Coinbase debería hacer recall ya.",2025-04-18 18:00:00
Nike,Nike App,neutral,"Nike App cumple con lo básico. Nada sorprendente, pero funciona.",2025-04-19 19:00:00
Tesla,Powerwall,negativo,Otro día más batallando con Powerwall de Tesla.,2025-04-20 05:00:00
Coinbase,Earn,negativo,Tuve una pésima experiencia con Earn de Coinbase. Decepcionante. 👎,2025-04-20 05:00:00
Nvidia,GeForce NOW,neutral,"Es un GeForce NOW más. No está mal, pero tampoco es la gran cosa.",2025-04-20 00:00:00
Nvidia,DLSS 3.5,negativo,He tenido más problemas que beneficios con el DLSS 3.5 de Nvidia.,2025-04-16 07:00:00
Coinbase,Coinbase Pro,negativo,El soporte de Coinbase no resolvió nada con mi Coinbase Pro. 🤬,2025-04-15 10:00:00
Meta,Instagram,positivo,Nunca pensé que Instagram de Meta fuera tan bueno. Sorprendido. 👍,2025-04-15 14:00:00
Meta,Oculus Quest,negativo,El soporte de Meta no resolvió nada con mi Oculus Quest. 🤬,2025-04-19 12:00:00
Coinbase,Coinbase Pro,positivo,¡Amo mi nuevo Coinbase Pro de Coinbase! 🥳,2025-04-17 17:00:00
Nvidia,CUDA Toolkit,neutral,Vi muchas reseñas del CUDA Toolkit de Nvidia. Opiniones divididas.,2025-04-16 14:00:00
Nvidia,CUDA Toolkit,neutral,Nvidia lanzó el nuevo CUDA Toolkit. Alguien ya lo probó?,2025-04-20 04:00:00
Nvidia,GeForce NOW,positivo,¡Amo mi nuevo GeForce NOW de Nvidia! 🥳,2025-04-16 17:00:00
Binance,Earn Program,positivo,"Binance se la rifó con el Earn Program, está brutal 😍",2025-04-20 05:00:00
Tesla,Autopilot,neutral,No entiendo el hype con el Autopilot de Tesla. Meh.,2025-04-16 09:00:00
Nike,Nike App,neutral,Probando el Nike App de Nike. Aún no sé qué pensar.,2025-04-15 19:00:00
Coinbase,Earn,neutral,Coinbase lanzó el nuevo Earn. Alguien ya lo probó?,2025-04-17 19:00:00
Nike,Air Max,neutral,No entiendo el hype con el Air Max de Nike. Meh.,2025-04-19 19:00:00
Tesla,Model 3,negativo,He tenido más problemas que beneficios con el Model 3 de Tesla.,2025-04-19 10:00:00
Nvidia,CUDA Toolkit,negativo,Otro día más batallando con CUDA Toolkit de Nvidia.,2025-04-16 19:00:00
Coinbase,Earn,negativo,"Ya van 3 veces que falla el Earn. ¿Qué pasa, Coinbase?",2025-04-16 16:00:00
Meta,Oculus Quest,positivo,¡Amo mi nuevo Oculus Quest de Meta! 🥳,2025-04-19 20:00:00
Apple,iOS 18,negativo,Nunca volveré a comprar un iOS 18 de Apple. Estafa total.,2025-04-20 06:00:00
Nike,Jordan Retro,negativo,Tuve una pésima experiencia con Jordan Retro de Nike. Decepcionante. 👎,2025-04-16 22:00:00
Nike,Air Max,positivo,Nunca pensé que Air Max de Nike fuera tan bueno. Sorprendido. 👍,2025-04-16 06:00:00
Meta,Threads,neutral,No tengo quejas ni elogios del Threads de Meta.,2025-04-15 22:00:00
Coinbase,NFT platform,positivo,El servicio de Coinbase con NFT platform fue impecable. 10/10 ⭐,2025-04-18 04:00:00
Nike,Air Max,negativo,"Ya van 3 veces que falla el Air Max. ¿Qué pasa, Nike?",2025-04-17 05:00:00
Nvidia,DLSS 3.5,neutral,"Interesante propuesta con DLSS 3.5 de Nvidia, veremos cómo evoluciona.",2025-04-19 02:00:00
Nike,Jordan Retro,negativo,Nunca volveré a comprar un Jordan Retro de Nike. Estafa total.,2025-04-15 23:00:00
Tesla,Model 3,neutral,"Model 3 cumple con lo básico. Nada sorprendente, pero funciona.",2025-04-16 21:00:00
Meta,Facebook Ads,positivo,Lo de Meta con el Facebook Ads es otro nivel. 😎,2025-04-19 18:00:00
Nike,Nike Run Club,positivo,El servicio de Nike con Nike Run Club fue impecable. 10/10 ⭐,2025-04-16 00:00:00
Coinbase,Coinbase Pro,negativo,"Coinbase Pro no sirve para nada, Coinbase debería hacer recall ya.",2025-04-18 19:00:00
Tesla,Model Y,neutral,Parece estable el Model Y de Tesla. Veremos con el tiempo.,2025-04-16 12:00:00
Coinbase,NFT platform,positivo,Muy satisfecho con NFT platform de Coinbase. No esperaba menos.,2025-04-18 23:00:00
Nike,Nike App,neutral,Nike lanzó el nuevo Nike App. Alguien ya lo probó?,2025-04-20 03:00:00
Tesla,Model 3,neutral,Tesla lanzó el nuevo Model 3. Alguien ya lo probó?,2025-04-16 03:00:00
Meta,Threads,negativo,Malísimo el Threads de Meta. No lo recomiendo. 👎,2025-04-19 22:00:00
Nike,Air Max,neutral,"Interesante propuesta con Air Max de Nike, veremos cómo evoluciona.",2025-04-17 10:00:00
Apple,MacBook Air,neutral,No tengo quejas ni elogios del MacBook Air de Apple.,2025-04-19 10:00:00
Coinbase,Coinbase Pro,neutral,No entiendo el hype con el Coinbase Pro de Coinbase. Meh.,2025-04-19 09:00:00
Apple,iPhone 15,negativo,"iPhone 15 no sirve para nada, Apple debería hacer recall ya.",2025-04-18 00:00:00
Apple,iPhone 15,positivo,Lo de Apple con el iPhone 15 es otro nivel. 😎,2025-04-16 21:00:00
Binance,Earn Program,negativo,Otro día más batallando con Earn Program de Binance.,2025-04-17 05:00:00
Meta,Oculus Quest,neutral,El Oculus Quest de Meta es... aceptable.,2025-04-20 00:00:00
Nvidia,GeForce NOW,negativo,Tuve una pésima experiencia con GeForce NOW de Nvidia. Decepcionante. 👎,2025-04-18 15:00:00
Nike,Jordan Retro,positivo,El servicio de Nike con Jordan Retro fue impecable. 10/10 ⭐,2025-04-15 15:00:00
Nike,Nike Run Club,neutral,Vi muchas reseñas del Nike Run Club de Nike. Opiniones divididas.,2025-04-19 08:00:00
Binance,Smart Chain,positivo,Lo de Binance con el Smart Chain es otro nivel. 😎,2025-04-18 01:00:00
Binance,Earn Program,neutral,"Earn Program cumple con lo básico. Nada sorprendente, pero funciona.",2025-04-20 01:00:00
Coinbase,Earn,positivo,La mejor inversión que he hecho este año es Earn de Coinbase. 🔥,2025-04-17 07:00:00
Coinbase,NFT platform,negativo,"Ya van 3 veces que falla el NFT platform. ¿Qué pasa, Coinbase?",2025-04-20 06:00:00
Tesla,Model 3,negativo,"Model 3 no sirve para nada, Tesla debería hacer recall ya.",2025-04-17 11:00:00
Tesla,Powerwall,neutral,No tengo quejas ni elogios del Powerwall de Tesla.,2025-04-16 05:00:00
Nvidia,RTX 4090,neutral,El RTX 4090 de Nvidia es... aceptable.,2025-04-15 11:00:00
Binance,Smart Chain,negativo,Nunca volveré a comprar un Smart Chain de Binance. Estafa total.,2025-04-19 23:00:00
Tesla,Model 3,negativo,Otro día más batallando con Model 3 de Tesla.,2025-04-19 11:00:00
Coinbase,Wallet,neutral,El Wallet de Coinbase es... aceptable.,2025-04-18 19:00:00
Coinbase,NFT platform,neutral,Coinbase lanzó el nuevo NFT platform. Alguien ya lo probó?,2025-04-18 05:00:00
Nvidia,RTX 4090,neutral,Parece estable el RTX 4090 de Nvidia. Veremos con el tiempo.,2025-04-18 14:00:00
Meta,Oculus Quest,positivo,El servicio de Meta con Oculus Quest fue impecable. 10/10 ⭐,2025-04-20 05:00:00
Apple,iPhone 15,negativo,Otro día más batallando con iPhone 15 de Apple.,2025-04-17 14:00:00
Coinbase,NFT platform,negativo,"Ya van 3 veces que falla el NFT platform. ¿Qué pasa, Coinbase?",2025-04-15 17:00:00
Nvidia,DLSS 3.5,neutral,"Es un DLSS 3.5 más. No está mal, pero tampoco es la gran cosa.",2025-04-18 21:00:00
Apple,MacBook Air,negativo,El soporte de Apple no resolvió nada con mi MacBook Air. 🤬,2025-04-16 09:00:00
Apple,iPhone 15,neutral,Apple lanzó el nuevo iPhone 15. Alguien ya lo probó?,2025-04-18 03:00:00
Coinbase,NFT platform,positivo,El servicio de Coinbase con NFT platform fue impecable. 10/10 ⭐,2025-04-18 03:00:00
Nike,Nike Run Club,positivo,La mejor inversión que he hecho este año es Nike Run Club de Nike. 🔥,2025-04-15 10:00:00
Nvidia,CUDA Toolkit,neutral,"Interesante propuesta con CUDA Toolkit de Nvidia, veremos cómo evoluciona.",2025-04-18 11:00:00
Binance,Binance App,positivo,Nunca pensé que Binance App de Binance fuera tan bueno. Sorprendido. 👍,2025-04-19 14:00:00
Nike,Jordan Retro,negativo,"Jordan Retro no sirve para nada, Nike debería hacer recall ya.",2025-04-17 00:00:00
Apple,iPhone 15,negativo,He tenido más problemas que beneficios con el iPhone 15 de Apple.,2025-04-17 09:00:00
Binance,Launchpad,neutral,"Es un Launchpad más. No está mal, pero tampoco es la gran cosa.",2025-04-15 10:00:00
Apple,Apple Watch,positivo,Nunca pensé que Apple Watch de Apple fuera tan bueno. Sorprendido. 👍,2025-04-16 05:00:00
Tesla,Model 3,positivo,Nunca pensé que Model 3 de Tesla fuera tan bueno. Sorprendido. 👍,2025-04-16 22:00:00
Apple,MacBook Air,neutral,Probando el MacBook Air de Apple. Aún no sé qué pensar.,2025-04-15 22:00:00
Nvidia,RTX 4090,neutral,Nvidia lanzó el nuevo RTX 4090. Alguien ya lo probó?,2025-04-18 13:00:00
Nvidia,CUDA Toolkit,neutral,No tengo quejas ni elogios del CUDA Toolkit de Nvidia.,2025-04-18 18:00:00
Meta,Oculus Quest,negativo,"Meta, ¿qué les pasó con el Oculus Quest? Está lleno de fallas. 😤",2025-04-17 17:00:00
Apple,iPhone 15,positivo,"Apple se la rifó con el iPhone 15, está brutal 😍",2025-04-16 08:00:00
Apple,iOS 18,positivo,¡Amo mi nuevo iOS 18 de Apple! 🥳,2025-04-16 01:00:00
Meta,Instagram,positivo,Nunca pensé que Instagram de Meta fuera tan bueno. Sorprendido. 👍,2025-04-19 11:00:00
Nvidia,GeForce NOW,negativo,He tenido más problemas que beneficios con el GeForce NOW de Nvidia.,2025-04-20 02:00:00
Apple,Apple Watch,neutral,Parece estable el Apple Watch de Apple. Veremos con el tiempo.,2025-04-17 01:00:00
Binance,Earn Program,neutral,El Earn Program de Binance es... aceptable.,2025-04-18 00:00:00
Nvidia,RTX 4090,positivo,El servicio de Nvidia con RTX 4090 fue impecable. 10/10 ⭐,2025-04-15 09:00:00
Tesla,Model 3,negativo,Nunca volveré a comprar un Model 3 de Tesla. Estafa total.,2025-04-19 23:00:00
Nvidia,DLSS 3.5,negativo,He tenido más problemas que beneficios con el DLSS 3.5 de Nvidia.,2025-04-17 05:00:00
Nvidia,RTX 4090,neutral,"RTX 4090 cumple con lo básico. Nada sorprendente, pero funciona.",2025-04-20 08:00:00
Nvidia,RTX 4090,positivo,Nunca pensé que RTX 4090 de Nvidia fuera tan bueno. Sorprendido. 👍,2025-04-19 06:00:00
Tesla,Model 3,positivo,Nunca pensé que Model 3 de Tesla fuera tan bueno. Sorprendido. 👍,2025-04-18 03:00:00
Meta,Oculus Quest,positivo,Muy satisfecho con Oculus Quest de Meta. No esperaba menos.,2025-04-17 23:00:00
Binance,Earn Program,positivo,Lo de Binance con el Earn Program es otro nivel. 😎,2025-04-17 10:00:00
Meta,Oculus Quest,positivo,No puedo creer lo bien que funciona el Oculus Quest de Meta. Recomendado. 💯,2025-04-18 13:00:00
Apple,iOS 18,neutral,Parece estable el iOS 18 de Apple. Veremos con el tiempo.,2025-04-16 09:00:00
Binance,Launchpad,positivo,Muy satisfecho con Launchpad de Binance. No esperaba menos.,2025-04-16 01:00:00
Tesla,Model Y,neutral,"Model Y cumple con lo básico. Nada sorprendente, pero funciona.",2025-04-17 20:00:00
Coinbase,Earn,positivo,El servicio de Coinbase con Earn fue impecable. 10/10 ⭐,2025-04-16 09:00:00
Nike,Air Max,neutral,Probando el Air Max de Nike. Aún no sé qué pensar.,2025-04-20 01:00:00
Tesla,Model Y,positivo,El servicio de Tesla con Model Y fue impecable. 10/10 ⭐,2025-04-20 08:00:00
Binance,Binance App,positivo,"Binance se la rifó con el Binance App, está brutal 😍",2025-04-19 22:00:00
Coinbase,Wallet,negativo,"Wallet no sirve para nada, Coinbase debería hacer recall ya.",2025-04-17 11:00:00
Nike,Nike App,negativo,Tuve una pésima experiencia con Nike App de Nike. Decepcionante. 👎,2025-04-15 12:00:00
Nike,Jordan Retro,positivo,Nunca pensé que Jordan Retro de Nike fuera tan bueno. Sorprendido. 👍,2025-04-17 08:00:00
Meta,Facebook Ads,positivo,"Facebook Ads me ha cambiado la vida. Gracias, Meta. ❤️",2025-04-17 22:00:00
Binance,Smart Chain,negativo,"Ya van 3 veces que falla el Smart Chain. ¿Qué pasa, Binance?",2025-04-15 12:00:00
Binance,Binance App,negativo,Tuve una pésima experiencia con Binance App de Binance. Decepcionante. 👎,2025-04-20 07:00:00
Nvidia,GeForce NOW,positivo,Muy satisfecho con GeForce NOW de Nvidia. No esperaba menos.,2025-04-16 00:00:00
Meta,Facebook Ads,negativo,He tenido más problemas que beneficios con el Facebook Ads de Meta.,2025-04-18 15:00:00
Tesla,Model 3,neutral,"Es un Model 3 más. No está mal, pero tampoco es la gran cosa.",2025-04-20 08:00:00
Binance,Smart Chain,positivo,Lo de Binance con el Smart Chain es otro nivel. 😎,2025-04-19 04:00:00
Tesla,Autopilot,positivo,"Desde que uso Autopilot, soy más feliz. Gracias Tesla! 😊",2025-04-16 16:00:00
Nike,Nike Run Club,neutral,"Es un Nike Run Club más. No está mal, pero tampoco es la gran cosa.",2025-04-19 16:00:00
Apple,iPhone 15,neutral,Probando el iPhone 15 de Apple. Aún no sé qué pensar.,2025-04-17 16:00:00
Meta,Instagram,positivo,Lo de Meta con el Instagram es otro nivel. 😎,2025-04-17 17:00:00
Coinbase,Wallet,negativo,El soporte de Coinbase no resolvió nada con mi Wallet. 🤬,2025-04-15 14:00:00
Nike,Air Max,neutral,Vi muchas reseñas del Air Max de Nike. Opiniones divididas.,2025-04-15 09:00:00
Apple,Apple Watch,neutral,Apple lanzó el nuevo Apple Watch. Alguien ya lo probó?,2025-04-19 01:00:00
Meta,Instagram,positivo,¡Amo mi nuevo Instagram de Meta! 🥳,2025-04-17 18:00:00
Binance,Smart Chain,positivo,El servicio de Binance con Smart Chain fue impecable. 10/10 ⭐,2025-04-16 10:00:00
Nvidia,RTX 4090,neutral,No tengo quejas ni elogios del RTX 4090 de Nvidia.,2025-04-17 22:00:00
Apple,iPhone 15,neutral,"iPhone 15 cumple con lo básico. Nada sorprendente, pero funciona.",2025-04-17 00:00:00
Apple,iPhone 15,negativo,Otro día más batallando con iPhone 15 de Apple.,2025-04-18 05:00:00
Binance,Binance App,neutral,No tengo quejas ni elogios del Binance App de Binance.,2025-04-16 21:00:00
Meta,Instagram,negativo,Tuve una pésima experiencia con Instagram de Meta. Decepcionante. 👎,2025-04-17 04:00:00
Apple,Apple Watch,neutral,"Interesante propuesta con Apple Watch de Apple, veremos cómo evoluciona.",2025-04-17 06:00:00
Meta,Oculus Quest,positivo,Lo de Meta con el Oculus Quest es otro nivel. 😎,2025-04-15 23:00:00
Meta,Threads,positivo,¡Amo mi nuevo Threads de Meta! 🥳,2025-04-19 23:00:00
Tesla,Model Y,negativo,Nunca volveré a comprar un Model Y de Tesla. Estafa total.,2025-04-17 07:00:00
Meta,Instagram,negativo,"Ya van 3 veces que falla el Instagram. ¿Qué pasa, Meta?",2025-04-17 04:00:00
Coinbase,Coinbase Pro,negativo,Tuve una pésima experiencia con Coinbase Pro de Coinbase. Decepcionante. 👎,2025-04-15 20:00:00
Coinbase,NFT platform,negativo,Nunca volveré a comprar un NFT platform de Coinbase. Estafa total.,2025-04-15 13:00:00
Tesla,Model 3,positivo,Muy satisfecho con Model 3 de Tesla. No esperaba menos.,2025-04-20 08:00:00
Binance,Binance App,negativo,El Binance App de Binance no vale lo que cuesta. 😡,2025-04-18 07:00:00
Nvidia,RTX 4090,negativo,Malísimo el RTX 4090 de Nvidia. No lo recomiendo. 👎,2025-04-18 19:00:00
Nvidia,GeForce NOW,positivo,No puedo creer lo bien que funciona el GeForce NOW de Nvidia. Recomendado. 💯,2025-04-20 00:00:00
Nvidia,DLSS 3.5,negativo,"Nvidia, ¿qué les pasó con el DLSS 3.5? Está lleno de fallas. 😤",2025-04-17 14:00:00
Nvidia,GeForce NOW,neutral,Nvidia lanzó el nuevo GeForce NOW. Alguien ya lo probó?,2025-04-18 22:00:00
Coinbase,NFT platform,positivo,"Desde que uso NFT platform, soy más feliz. Gracias Coinbase! 😊",2025-04-17 15:00:00
Binance,Binance App,negativo,He tenido más problemas que beneficios con el Binance App de Binance.,2025-04-16 23:00:00
Binance,Earn Program,negativo,Otro día más batallando con Earn Program de Binance.,2025-04-19 20:00:00
Binance,Smart Chain,negativo,"Smart Chain no sirve para nada, Binance debería hacer recall ya.",2025-04-18 18:00:00
Coinbase,NFT platform,positivo,Nunca pensé que NFT platform de Coinbase fuera tan bueno. Sorprendido. 👍,2025-04-17 05:00:00
Nike,Nike Run Club,positivo,Lo de Nike con el Nike Run Club es otro nivel. 😎,2025-04-15 19:00:00
Tesla,Model 3,negativo,Tuve una pésima experiencia con Model 3 de Tesla. Decepcionante. 👎,2025-04-18 03:00:00
Nvidia,CUDA Toolkit,positivo,No puedo creer lo bien que funciona el CUDA Toolkit de Nvidia. Recomendado. 💯,2025-04-18 01:00:00
Nike,Jordan Retro,negativo,El soporte de Nike no resolvió nada con mi Jordan Retro. 🤬,2025-04-20 05:00:00
Nike,Air Max,positivo,"Air Max me ha cambiado la vida. Gracias, Nike. ❤️",2025-04-18 01:00:00
Nike,Air Max,neutral,"Air Max cumple con lo básico. Nada sorprendente, pero funciona.",2025-04-15 10:00:00
Nike,Jordan Retro,positivo,¡Amo mi nuevo Jordan Retro de Nike! 🥳,2025-04-19 19:00:00
Coinbase,Wallet,positivo,La mejor inversión que he hecho este año es Wallet de Coinbase. 🔥,2025-04-19 03:00:00
Meta,Facebook Ads,negativo,Nunca volveré a comprar un Facebook Ads de Meta. Estafa total.,2025-04-15 10:00:00
Apple,iOS 18,positivo,"iOS 18 me ha cambiado la vida. Gracias, Apple. ❤️",2025-04-15 19:00:00
Nvidia,RTX 4090,positivo,Muy satisfecho con RTX 4090 de Nvidia. No esperaba menos.,2025-04-17 20:00:00
Nvidia,DLSS 3.5,neutral,No entiendo el hype con el DLSS 3.5 de Nvidia. Meh.,2025-04-16 05:00:00
Apple,iOS 18,positivo,"Apple se la rifó con el iOS 18, está brutal 😍",2025-04-16 01:00:00
Binance,Earn Program,positivo,No puedo creer lo bien que funciona el Earn Program de Binance. Recomendado. 💯,2025-04-17 07:00:00
Nvidia,RTX 4090,neutral,Probando el RTX 4090 de Nvidia. Aún no sé qué pensar.,2025-04-18 20:00:00
Tesla,Powerwall,neutral,"Es un Powerwall más. No está mal, pero tampoco es la gran cosa.",2025-04-18 09:00:00
Meta,Instagram,positivo,"Instagram me ha cambiado la vida. Gracias, Meta. ❤️",2025-04-18 10:00:00
Tesla,Model 3,negativo,"Model 3 no sirve para nada, Tesla debería hacer recall ya.",2025-04-18 13:00:00
Nike,Jordan Retro,neutral,No entiendo el hype con el Jordan Retro de Nike. Meh.,2025-04-17 04:00:00
Coinbase,Coinbase Pro,positivo,El servicio de Coinbase con Coinbase Pro fue impecable. 10/10 ⭐,2025-04-17 05:00:00
Nvidia,GeForce NOW,neutral,"Interesante propuesta con GeForce NOW de Nvidia, veremos cómo evoluciona.",2025-04-19 20:00:00
Apple,MacBook Air,neutral,El MacBook Air de Apple es... aceptable.,2025-04-19 05:00:00
Nvidia,GeForce NOW,negativo,Tuve una pésima experiencia con GeForce NOW de Nvidia. Decepcionante. 👎,2025-04-16 05:00:00
Coinbase,Wallet,neutral,Vi muchas reseñas del Wallet de Coinbase. Opiniones divididas.,2025-04-20 05:00:00
Apple,MacBook Air,positivo,"MacBook Air me ha cambiado la vida. Gracias, Apple. ❤️",2025-04-15 22:00:00
Coinbase,Earn,negativo,Otro día más batallando con Earn de Coinbase.,2025-04-16 05:00:00
Nike,Air Max,positivo,"Desde que uso Air Max, soy más feliz. Gracias Nike! 😊",2025-04-16 05:00:00
Meta,Threads,negativo,Otro día más batallando con Threads de Meta.,2025-04-17 04:00:00
Nike,Nike App,neutral,Vi muchas reseñas del Nike App de Nike. Opiniones divididas.,2025-04-15 08:00:00
Nike,Jordan Retro,negativo,Otro día más batallando con Jordan Retro de Nike.,2025-04-19 09:00:00
Nike,Nike Run Club,negativo,El soporte de Nike no resolvió nada con mi Nike Run Club. 🤬,2025-04-18 17:00:00
Nvidia,GeForce NOW,positivo,Muy satisfecho con GeForce NOW de Nvidia. No esperaba menos.,2025-04-20 03:00:00
Nike,Jordan Retro,neutral,El Jordan Retro de Nike es... aceptable.,2025-04-15 14:00:00
Apple,Apple Watch,positivo,Muy satisfecho con Apple Watch de Apple. No esperaba menos.,2025-04-18 03:00:00
Apple,iOS 18,negativo,"iOS 18 no sirve para nada, Apple debería hacer recall ya.",2025-04-17 03:00:00
Coinbase,Wallet,positivo,Nunca pensé que Wallet de Coinbase fuera tan bueno. Sorprendido. 👍,2025-04-18 19:00:00
Nvidia,GeForce NOW,positivo,"Nvidia se la rifó con el GeForce NOW, está brutal 😍",2025-04-19 17:00:00
Tesla,Powerwall,neutral,Parece estable el Powerwall de Tesla. Veremos con el tiempo.,2025-04-15 18:00:00
Coinbase,Wallet,positivo,Muy satisfecho con Wallet de Coinbase. No esperaba menos.,2025-04-17 13:00:00
Apple,MacBook Air,negativo,"Ya van 3 veces que falla el MacBook Air. ¿Qué pasa, Apple?",2025-04-17 13:00:00
Apple,iOS 18,neutral,"Es un iOS 18 más. No está mal, pero tampoco es la gran cosa.",2025-04-19 17:00:00
Tesla,Model Y,neutral,"Es un Model Y más. No está mal, pero tampoco es la gran cosa.",2025-04-16 03:00:00
Meta,Instagram,negativo,Nunca volveré a comprar un Instagram de Meta. Estafa total.,2025-04-16 22:00:00
Nvidia,RTX 4090,negativo,He tenido más problemas que beneficios con el RTX 4090 de Nvidia.,2025-04-18 06:00:00
Apple,MacBook Air,neutral,"Interesante propuesta con MacBook Air de Apple, veremos cómo evoluciona.",2025-04-18 22:00:00
Apple,iPhone 15,negativo,"Ya van 3 veces que falla el iPhone 15. ¿Qué pasa, Apple?",2025-04-15 18:00:00
Tesla,Powerwall,neutral,Probando el Powerwall de Tesla. Aún no sé qué pensar.,2025-04-15 12:00:00
Nvidia,RTX 4090,positivo,"Desde que uso RTX 4090, soy más feliz. Gracias Nvidia! 😊",2025-04-16 05:00:00
Coinbase,NFT platform,positivo,¡Amo mi nuevo NFT platform de Coinbase! 🥳,2025-04-18 04:00:00
Binance,Binance App,positivo,Nunca pensé que Binance App de Binance fuera tan bueno. Sorprendido. 👍,2025-04-16 16:00:00
Nike,Nike App,neutral,"Interesante propuesta con Nike App de Nike, veremos cómo evoluciona.",2025-04-19 13:00:00
Apple,Apple Watch,positivo,Muy satisfecho con Apple Watch de Apple. No esperaba menos.,2025-04-20 08:00:00
Coinbase,Earn,positivo,"Earn me ha cambiado la vida. Gracias, Coinbase. ❤️",2025-04-15 13:00:00
Meta,Oculus Quest,positivo,"Meta se la rifó con el Oculus Quest, está brutal 😍",2025-04-15 10:00:00
Apple,iPhone 15,positivo,Lo de Apple con el iPhone 15 es otro nivel. 😎,2025-04-16 05:00:00
Coinbase,Wallet,positivo,No puedo creer lo bien que funciona el Wallet de Coinbase. Recomendado. 💯,2025-04-20 08:00:00
Nike,Air Max,negativo,"Air Max no sirve para nada, Nike debería hacer recall ya.",2025-04-17 23:00:00
Binance,Smart Chain,neutral,Probando el Smart Chain de Binance. Aún no sé qué pensar.,2025-04-19 18:00:00
