empresa,producto,sentimiento,comentario,fecha_hora
Tesla,Model 3,positivo,Muy satisfecho con Model 3 de Tesla. No esperaba menos.,2025-04-19 23:00:00
Tesla,Model Y,neutral,"Es un Model Y más. No está mal, pero tampoco es la gran cosa.",2025-04-15 16:00:00
Nvidia,GeForce NOW,neutral,Vi muchas reseñas del GeForce NOW de Nvidia. Opiniones divididas.,2025-04-19 22:00:00
Apple,Apple Watch,positivo,"Desde que uso Apple Watch, soy más feliz. Gracias Apple! 😊",2025-04-17 17:00:00
Apple,Apple Watch,neutral,Vi muchas reseñas del Apple Watch de Apple. Opiniones divididas.,2025-04-19 09:00:00
Coinbase,Wallet,neutral,No entiendo el hype con el Wallet de Coinbase. Meh.,2025-04-15 11:00:00
Meta,Threads,neutral,Probando el Threads de Meta. Aún no sé qué pensar.,2025-04-15 13:00:00
Tesla,Autopilot,positivo,La mejor inversión que he hecho este año es Autopilot de Tesla. 🔥,2025-04-19 10:00:00
Nike,Nike Run Club,neutral,No tengo quejas ni elogios del Nike Run Club de Nike.,2025-04-18 23:00:00
Coinbase,NFT platform,positivo,¡Amo mi nuevo NFT platform de Coinbase! 🥳,2025-04-19 18:00:00
Coinbase,Wallet,neutral,No entiendo el hype con el Wallet de Coinbase. Meh.,2025-04-20 05:00:00
Binance,Smart Chain,positivo,Nunca pensé que Smart Chain de Binance fuera tan bueno. Sorprendido. 👍,2025-04-20 06:00:00
Nvidia,GeForce NOW,positivo,Muy satisfecho con GeForce NOW de Nvidia. No esperaba menos.,2025-04-19 13:00:00
Binance,Launchpad,positivo,"Launchpad me ha cambiado la vida. Gracias, Binance. ❤️",2025-04-16 12:00:00
Nike,Nike Run Club,negativo,Malísimo el Nike Run Club de Nike. No lo recomiendo. 👎,2025-04-19 01:00:00
Meta,Oculus Quest,positivo,"Oculus Quest me ha cambiado la vida. Gracias, Meta. ❤️",2025-04-15 19:00:00
Apple,iPhone 15,positivo,"Apple se la rifó con el iPhone 15, está brutal 😍",2025-04-19 05:00:00
Meta,Facebook Ads,positivo,"Meta se la rifó con el Facebook Ads, está brutal 😍",2025-04-18 06:00:00
Binance,Binance App,positivo,Nunca pensé que Binance App de Binance fuera tan bueno. Sorprendido. 👍,2025-04-20 06:00:00
Nvidia,GeForce NOW,neutral,"GeForce NOW cumple con lo básico. Nada sorprendente, pero funciona.",2025-04-18 10:00:00
Coinbase,NFT platform,positivo,"Coinbase se la rifó con el NFT platform, está brutal 😍",2025-04-19 10:00:00
Meta,Facebook Ads,positivo,Nunca pensé que Facebook Ads de Meta fuera tan bueno. Sorprendido. 👍,2025-04-20 01:00:00
Nvidia,RTX 4090,positivo,"Nvidia se la rifó con el RTX 4090, está brutal 😍",2025-04-16 07:00:00
Nvidia,DLSS 3.5,negativo,Otro día más batallando con DLSS 3.5 de Nvidia.,2025-04-19 00:00:00
Tesla,Autopilot,neutral,Parece estable el Autopilot de Tesla. Veremos con el tiempo.,2025-04-16 16:00:00
Coinbase,Coinbase Pro,positivo,¡Amo mi nuevo Coinbase Pro de Coinbase! 🥳,2025-04-16 01:00:00
Nvidia,CUDA Toolkit,negativo,"CUDA Toolkit no sirve para nada, Nvidia debería hacer recall ya.",2025-04-16 14:00:00
Binance,Smart Chain,positivo,"Binance se la rifó con el Smart Chain, está brutal 😍",2025-04-19 23:00:00
Nike,Jordan Retro,negativo,Nunca volveré a comprar un Jordan Retro de Nike. Estafa total.,2025-04-17 19:00:00
Coinbase,Earn,neutral,"Interesante propuesta con Earn de Coinbase, veremos cómo evoluciona.",2025-04-17 22:00:00
Binance,Earn Program,positivo,Muy satisfecho con Earn Program de Binance. No esperaba menos.,2025-04-18 23:00:00
Tesla,Autopilot,positivo,La mejor inversión que he hecho este año es Autopilot de Tesla. 🔥,2025-04-19 02:00:00
Apple,iOS 18,neutral,El iOS 18 de Apple es... aceptable.,2025-04-19 15:00:00
Apple,MacBook Air,neutral,El MacBook Air de Apple es... aceptable.,2025-04-18 18:00:00
Binance,Launchpad,positivo,"Launchpad me ha cambiado la vida. Gracias, Binance. ❤️",2025-04-17 13:00:00
Apple,iOS 18,neutral,El iOS 18 de Apple es... aceptable.,2025-04-15 18:00:00
Apple,Apple Watch,negativo,He tenido más problemas que beneficios con el Apple Watch de Apple.,2025-04-15 14:00:00
Nike,Nike Run Club,positivo,No puedo creer lo bien que funciona el Nike Run Club de Nike. Recomendado. 💯,2025-04-17 12:00:00
Binance,Earn Program,neutral,Probando el Earn Program de Binance. Aún no sé qué pensar.,2025-04-16 15:00:00
Nvidia,CUDA Toolkit,negativo,El CUDA Toolkit de Nvidia no vale lo que cuesta. 😡,2025-04-19 22:00:00
Coinbase,NFT platform,neutral,Probando el NFT platform de Coinbase. Aún no sé qué pensar.,2025-04-19 06:00:00
Apple,iOS 18,neutral,Parece estable el iOS 18 de Apple. Veremos con el tiempo.,2025-04-16 06:00:00
Nike,Air Max,negativo,El soporte de Nike no resolvió nada con mi Air Max. 🤬,2025-04-16 07:00:00
Binance,Smart Chain,neutral,No entiendo el hype con el Smart Chain de Binance. Meh.,2025-04-19 20:00:00
Nike,Jordan Retro,negativo,El soporte de Nike no resolvió nada con mi Jordan Retro. 🤬,2025-04-18 07:00:00
Apple,iPhone 15,neutral,"Interesante propuesta con iPhone 15 de Apple, veremos cómo evoluciona.",2025-04-16 02:00:00
Coinbase,Wallet,positivo,La mejor inversión que he hecho este año es Wallet de Coinbase. 🔥,2025-04-15 22:00:00
Apple,Apple Watch,negativo,Nunca volveré a comprar un Apple Watch de Apple. Estafa total.,2025-04-19 14:00:00
Apple,iOS 18,neutral,Vi muchas reseñas del iOS 18 de Apple. Opiniones divididas.,2025-04-16 19:00:00
Binance,Smart Chain,neutral,Probando el Smart Chain de Binance. Aún no sé qué pensar.,2025-04-18 19:00:00
Binance,Smart Chain,neutral,No tengo quejas ni elogios del Smart Chain de Binance.,2025-04-16 23:00:00
Nike,Nike App,negativo,El Nike App de Nike no vale lo que cuesta. 😡,2025-04-18 05:00:00
Meta,Facebook Ads,neutral,"Es un Facebook Ads más. No está mal, pero tampoco es la gran cosa.",2025-04-15 19:00:00
Coinbase,NFT platform,neutral,Parece estable el NFT platform de Coinbase. Veremos con el tiempo.,2025-04-17 05:00:00
Nike,Nike Run Club,neutral,Probando el Nike Run Club de Nike. Aún no sé qué pensar.,2025-04-20 08:00:00
Meta,Instagram,neutral,No tengo quejas ni elogios del Instagram de Meta.,2025-04-17 16:00:00
Apple,iOS 18,positivo,"iOS 18 me ha cambiado la vida. Gracias, Apple. ❤️",2025-04-17 14:00:00
Coinbase,Coinbase Pro,negativo,He tenido más problemas que beneficios con el Coinbase Pro de Coinbase.,2025-04-15 18:00:00
Apple,MacBook Air,neutral,El MacBook Air de Apple es... aceptable.,2025-04-18 21:00:00
Nike,Jordan Retro,neutral,"Jordan Retro cumple con lo básico. Nada sorprendente, pero funciona.",2025-04-19 08:00:00
Tesla,Model 3,positivo,Nunca pensé que Model 3 de Tesla fuera tan bueno. Sorprendido. 👍,2025-04-16 02:00:00
Tesla,Powerwall,neutral,"Interesante propuesta con Powerwall de Tesla, veremos cómo evoluciona.",2025-04-18 09:00:00
Binance,Binance App,neutral,El Binance App de Binance es... aceptable.,2025-04-20 00:00:00
Tesla,Autopilot,neutral,"Interesante propuesta con Autopilot de Tesla, veremos cómo evoluciona.",2025-04-17 01:00:00
Nike,Nike App,positivo,"Nike se la rifó con el Nike App, está brutal 😍",2025-04-18 00:00:00
Binance,Launchpad,positivo,La mejor inversión que he hecho este año es Launchpad de Binance. 🔥,2025-04-16 21:00:00
Nvidia,CUDA Toolkit,positivo,¡Amo mi nuevo CUDA Toolkit de Nvidia! 🥳,2025-04-18 12:00:00
Nvidia,DLSS 3.5,positivo,No puedo creer lo bien que funciona el DLSS 3.5 de Nvidia. Recomendado. 💯,2025-04-17 19:00:00
Meta,Instagram,positivo,"Meta se la rifó con el Instagram, está brutal 😍",2025-04-19 16:00:00
Apple,iOS 18,neutral,Vi muchas reseñas del iOS 18 de Apple. Opiniones divididas.,2025-04-18 02:00:00
Coinbase,Wallet,positivo,Muy satisfecho con Wallet de Coinbase. No esperaba menos.,2025-04-17 02:00:00
Nvidia,GeForce NOW,negativo,Tuve una pésima experiencia con GeForce NOW de Nvidia. Decepcionante. 👎,2025-04-17 13:00:00
Apple,Apple Watch,negativo,Tuve una pésima experiencia con Apple Watch de Apple. Decepcionante. 👎,2025-04-18 08:00:00
Apple,Apple Watch,positivo,"Apple Watch me ha cambiado la vida. Gracias, Apple. ❤️",2025-04-16 05:00:00
Meta,Instagram,neutral,Vi muchas reseñas del Instagram de Meta. Opiniones divididas.,2025-04-19 19:00:00
Meta,Facebook Ads,positivo,Nunca pensé que Facebook Ads de Meta fuera tan bueno. Sorprendido. 👍,2025-04-17 19:00:00
Meta,Instagram,negativo,Malísimo el Instagram de Meta. No lo recomiendo. 👎,2025-04-20 05:00:00
Nvidia,CUDA Toolkit,negativo,Otro día más batallando con CUDA Toolkit de Nvidia.,2025-04-16 15:00:00
Coinbase,Earn,neutral,"Es un Earn más. No está mal, pero tampoco es la gran cosa.",2025-04-20 06:00:00
Apple,MacBook Air,neutral,"Es un MacBook Air más. No está mal, pero tampoco es la gran cosa.",2025-04-17 05:00:00
Nike,Air Max,positivo,Muy satisfecho con Air Max de Nike. No esperaba menos.,2025-04-15 18:00:00
Meta,Oculus Quest,negativo,Tuve una pésima experiencia con Oculus Quest de Meta. Decepcionante. 👎,2025-04-15 12:00:00
Nike,Nike Run Club,positivo,"Desde que uso Nike Run Club, soy más feliz. Gracias Nike! 😊",2025-04-19 03:00:00
Meta,Instagram,positivo,Nunca pensé que Instagram de Meta fuera tan bueno. Sorprendido. 👍,2025-04-18 04:00:00
Coinbase,Coinbase Pro,neutral,"Coinbase Pro cumple con lo básico. Nada sorprendente, pero funciona.",2025-04-15 15:00:00
Binance,Launchpad,neutral,"Launchpad cumple con lo básico. Nada sorprendente, pero funciona.",2025-04-19 06:00:00
Nvidia,RTX 4090,positivo,No puedo creer lo bien que funciona el RTX 4090 de Nvidia. Recomendado. 💯,2025-04-17 00:00:00
Apple,Apple Watch,neutral,"Es un Apple Watch más. No está mal, pero tampoco es la gran cosa.",2025-04-17 04:00:00
Apple,Apple Watch,positivo,"Apple se la rifó con el Apple Watch, está brutal 😍",2025-04-19 13:00:00
Binance,Earn Program,neutral,"Earn Program cumple con lo básico. Nada sorprendente, pero funciona.",2025-04-20 08:00:00
Meta,Facebook Ads,negativo,"Ya van 3 veces que falla el Facebook Ads. ¿Qué pasa, Meta?",2025-04-18 04:00:00
Tesla,Model Y,negativo,"Model Y no sirve para nada, Tesla debería hacer recall ya.",2025-04-16 19:00:00
Nike,Jordan Retro,positivo,"Jordan Retro me ha cambiado la vida. Gracias, Nike. ❤️",2025-04-17 22:00:00
Tesla,Autopilot,negativo,El Autopilot de Tesla no vale lo que cuesta. 😡,2025-04-16 21:00:00
Tesla,Model Y,neutral,"Interesante propuesta con Model Y de Tesla, veremos cómo evoluciona.",2025-04-19 17:00:00
Nike,Air Max,positivo,La mejor inversión que he hecho este año es Air Max de Nike. 🔥,2025-04-16 23:00:00
Coinbase,Coinbase Pro,neutral,"Interesante propuesta con Coinbase Pro de Coinbase, veremos cómo evoluciona.",2025-04-16 07:00:00
Coinbase,Coinbase Pro,negativo,El Coinbase Pro de Coinbase no vale lo que cuesta. 😡,2025-04-15 08:00:00
Meta,Threads,positivo,Muy satisfecho con Threads de Meta. No esperaba menos.,2025-04-16 02:00:00
Binance,Smart Chain,positivo,Nunca pensé que Smart Chain de Binance fuera tan bueno. Sorprendido. 👍,2025-04-19 17:00:00
Meta,Instagram,negativo,"Ya van 3 veces que falla el Instagram. ¿Qué pasa, Meta?",2025-04-19 11:00:00
Coinbase,Earn,positivo,"Coinbase se la rifó con el Earn, está brutal 😍",2025-04-19 11:00:00
Nike,Nike App,neutral,"Nike App cumple con lo básico. Nada sorprendente, pero funciona.",2025-04-15 13:00:00
Nike,Jordan Retro,positivo,Lo de Nike con el Jordan Retro es otro nivel. 😎,2025-04-17 23:00:00
Coinbase,Earn,neutral,"Interesante propuesta con Earn de Coinbase, veremos cómo evoluciona.",2025-04-15 09:00:00
Meta,Oculus Quest,positivo,"Desde que uso Oculus Quest, soy más feliz. Gracias Meta! 😊",2025-04-19 03:00:00
Meta,Instagram,neutral,"Es un Instagram más. No está mal, pero tampoco es la gran cosa.",2025-04-16 01:00:00
Tesla,Model 3,negativo,El Model 3 de Tesla no vale lo que cuesta. 😡,2025-04-16 17:00:00
Meta,Threads,negativo,He tenido más problemas que beneficios con el Threads de Meta.,2025-04-18 14:00:00
Nvidia,CUDA Toolkit,positivo,El servicio de Nvidia con CUDA Toolkit fue impecable. 10/10 ⭐,2025-04-16 22:00:00
Binance,Launchpad,neutral,No tengo quejas ni elogios del Launchpad de Binance.,2025-04-15 23:00:00
Nike,Nike Run Club,neutral,"Interesante propuesta con Nike Run Club de Nike, veremos cómo evoluciona.",2025-04-18 10:00:00
Meta,Oculus Quest,neutral,"Oculus Quest cumple con lo básico. Nada sorprendente, pero funciona.",2025-04-18 07:00:00
Meta,Instagram,neutral,El Instagram de Meta es... aceptable.,2025-04-19 23:00:00
Apple,iOS 18,positivo,La mejor inversión que he hecho este año es iOS 18 de Apple. 🔥,2025-04-18 11:00:00
Coinbase,Wallet,neutral,El Wallet de Coinbase es... aceptable.,2025-04-15 15:00:00
Nike,Nike Run Club,negativo,"Ya van 3 veces que falla el Nike Run Club. ¿Qué pasa, Nike?",2025-04-18 18:00:00
Binance,Binance App,negativo,Otro día más batallando con Binance App de Binance.,2025-04-20 02:00:00
Coinbase,NFT platform,positivo,La mejor inversión que he hecho este año es NFT platform de Coinbase. 🔥,2025-04-17 01:00:00
Coinbase,Earn,neutral,No entiendo el hype con el Earn de Coinbase. Meh.,2025-04-15 10:00:00
Apple,Apple Watch,positivo,Lo de Apple con el Apple Watch es otro nivel. 😎,2025-04-16 03:00:00
Nike,Air Max,negativo,He tenido más problemas que beneficios con el Air Max de Nike.,2025-04-17 05:00:00
Tesla,Powerwall,positivo,La mejor inversión que he hecho este año es Powerwall de Tesla. 🔥,2025-04-17 17:00:00
Meta,Oculus Quest,neutral,"Oculus Quest cumple con lo básico. Nada sorprendente, pero funciona.",2025-04-20 02:00:00
Apple,iOS 18,negativo,Malísimo el iOS 18 de Apple. No lo recomiendo. 👎,2025-04-18 19:00:00
Nvidia,RTX 4090,neutral,No entiendo el hype con el RTX 4090 de Nvidia. Meh.,2025-04-18 15:00:00
Meta,Facebook Ads,positivo,Nunca pensé que Facebook Ads de Meta fuera tan bueno. Sorprendido. 👍,2025-04-17 19:00:00
Apple,iOS 18,negativo,Otro día más batallando con iOS 18 de Apple.,2025-04-15 22:00:00
Nike,Nike App,negativo,Nunca volveré a comprar un Nike App de Nike. Estafa total.,2025-04-15 10:00:00
Nike,Nike Run Club,negativo,"Ya van 3 veces que falla el Nike Run Club. ¿Qué pasa, Nike?",2025-04-15 10:00:00
Tesla,Powerwall,positivo,"Tesla se la rifó con el Powerwall, está brutal 😍",2025-04-17 13:00:00
Apple,Apple Watch,neutral,No entiendo el hype con el Apple Watch de Apple. Meh.,2025-04-17 08:00:00
Apple,MacBook Air,negativo,"MacBook Air no sirve para nada, Apple debería hacer recall ya.",2025-04-20 04:00:00
Apple,iOS 18,positivo,La mejor inversión que he hecho este año es iOS 18 de Apple. 🔥,2025-04-16 06:00:00
Coinbase,Earn,neutral,Coinbase lanzó el nuevo Earn. Alguien ya lo probó?,2025-04-18 21:00:00
Meta,Oculus Quest,neutral,"Interesante propuesta con Oculus Quest de Meta, veremos cómo evoluciona.",2025-04-15 11:00:00
Tesla,Model Y,neutral,Tesla lanzó el nuevo Model Y. Alguien ya lo probó?,2025-04-17 07:00:00
Nvidia,CUDA Toolkit,positivo,"Desde que uso CUDA Toolkit, soy más feliz. Gracias Nvidia! 😊",2025-04-15 21:00:00
Binance,Smart Chain,negativo,"Binance, ¿qué les pasó con el Smart Chain? Está lleno de fallas. 😤",2025-04-17 02:00:00
Apple,iPhone 15,positivo,¡Amo mi nuevo iPhone 15 de Apple! 🥳,2025-04-18 10:00:00
Coinbase,Coinbase Pro,neutral,No tengo quejas ni elogios del Coinbase Pro de Coinbase.,2025-04-18 01:00:00
Binance,Smart Chain,negativo,El Smart Chain de Binance no vale lo que cuesta. 😡,2025-04-15 18:00:00
Nvidia,RTX 4090,neutral,"Es un RTX 4090 más. No está mal, pero tampoco es la gran cosa.",2025-04-17 12:00:00
Apple,iPhone 15,positivo,"Desde que uso iPhone 15, soy más feliz. Gracias Apple! 😊",2025-04-15 17:00:00
Nvidia,RTX 4090,negativo,El soporte de Nvidia no resolvió nada con mi RTX 4090. 🤬,2025-04-15 23:00:00
Apple,MacBook Air,neutral,"Interesante propuesta con MacBook Air de Apple, veremos cómo evoluciona.",2025-04-17 07:00:00
Coinbase,Wallet,negativo,El soporte de Coinbase no resolvió nada con mi Wallet. 🤬,2025-04-19 20:00:00
Nike,Nike App,neutral,Vi muchas reseñas del Nike App de Nike. Opiniones divididas.,2025-04-15 19:00:00
Binance,Launchpad,negativo,Nunca volveré a comprar un Launchpad de Binance. Estafa total.,2025-04-17 03:00:00
Tesla,Autopilot,neutral,Probando el Autopilot de Tesla. Aún no sé qué pensar.,2025-04-17 04:00:00
Nike,Nike App,positivo,Lo de Nike con el Nike App es otro nivel. 😎,2025-04-19 14:00:00
Tesla,Powerwall,neutral,"Interesante propuesta con Powerwall de Tesla, veremos cómo evoluciona.",2025-04-17 04:00:00
Meta,Facebook Ads,positivo,"Desde que uso Facebook Ads, soy más feliz. Gracias Meta! 😊",2025-04-15 20:00:00
Nike,Air Max,negativo,Tuve una pésima experiencia con Air Max de Nike. Decepcionante. 👎,2025-04-16 08:00:00
Binance,Binance App,neutral,"Es un Binance App más. No está mal, pero tampoco es la gran cosa.",2025-04-15 12:00:00
Coinbase,Coinbase Pro,neutral,"Es un Coinbase Pro más. No está mal, pero tampoco es la gran cosa.",2025-04-20 03:00:00
Meta,Facebook Ads,negativo,He tenido más problemas que beneficios con el Facebook Ads de Meta.,2025-04-17 03:00:00
Nike,Nike App,positivo,"Nike App me ha cambiado la vida. Gracias, Nike. ❤️",2025-04-18 01:00:00
Nike,Nike Run Club,positivo,¡Amo mi nuevo Nike Run Club de Nike! 🥳,2025-04-19 16:00:00
Binance,Binance App,positivo,"Binance App me ha cambiado la vida. Gracias, Binance. ❤️",2025-04-16 22:00:00
Meta,Oculus Quest,positivo,Lo de Meta con el Oculus Quest es otro nivel. 😎,2025-04-20 04:00:00
Meta,Facebook Ads,positivo,Lo de Meta con el Facebook Ads es otro nivel. 😎,2025-04-15 17:00:00
Binance,Launchpad,negativo,"Launchpad no sirve para nada, Binance debería hacer recall ya.",2025-04-17 22:00:00
Tesla,Model 3,negativo,"Tesla, ¿qué les pasó con el Model 3? Está lleno de fallas. 😤",2025-04-19 20:00:00
Binance,Smart Chain,neutral,Binance lanzó el nuevo Smart Chain. Alguien ya lo probó?,2025-04-17 08:00:00
Apple,MacBook Air,negativo,El soporte de Apple no resolvió nada con mi MacBook Air. 🤬,2025-04-16 05:00:00
Nike,Air Max,neutral,Nike lanzó el nuevo Air Max. Alguien ya lo probó?,2025-04-18 00:00:00
Tesla,Model Y,negativo,He tenido más problemas que beneficios con el Model Y de Tesla.,2025-04-20 05:00:00
Binance,Binance App,neutral,"Interesante propuesta con Binance App de Binance, veremos cómo evoluciona.",2025-04-17 05:00:00
Nvidia,DLSS 3.5,positivo,"Desde que uso DLSS 3.5, soy más feliz. Gracias Nvidia! 😊",2025-04-20 01:00:00
Meta,Threads,neutral,Vi muchas reseñas del Threads de Meta. Opiniones divididas.,2025-04-19 04:00:00
Apple,iOS 18,positivo,Muy satisfecho con iOS 18 de Apple. No esperaba menos.,2025-04-18 14:00:00
Tesla,Powerwall,neutral,El Powerwall de Tesla es... aceptable.,2025-04-15 10:00:00
Nike,Air Max,neutral,El Air Max de Nike es... aceptable.,2025-04-17 14:00:00
Meta,Facebook Ads,negativo,"Meta, ¿qué les pasó con el Facebook Ads? Está lleno de fallas. 😤",2025-04-18 18:00:00
Nike,Nike Run Club,neutral,No entiendo el hype con el Nike Run Club de Nike. Meh.,2025-04-16 10:00:00
Apple,iOS 18,positivo,No puedo creer lo bien que funciona el iOS 18 de Apple. Recomendado. 💯,2025-04-18 07:00:00
Tesla,Model 3,negativo,Nunca volveré a comprar un Model 3 de Tesla. Estafa total.,2025-04-17 17:00:00
Nvidia,GeForce NOW,negativo,"Nvidia, ¿qué les pasó con el GeForce NOW? Está lleno de fallas. 😤",2025-04-20 08:00:00
Nike,Nike Run Club,negativo,El Nike Run Club de Nike no vale lo que cuesta. 😡,2025-04-18 19:00:00
Nike,Nike Run Club,negativo,Otro día más batallando con Nike Run Club de Nike.,2025-04-19 01:00:00
Coinbase,Coinbase Pro,neutral,Coinbase lanzó el nuevo Coinbase Pro. Alguien ya lo probó?,2025-04-19 15:00:00
Apple,Apple Watch,negativo,He tenido más problemas que beneficios con el Apple Watch de Apple.,2025-04-16 06:00:00
Coinbase,Earn,negativo,Malísimo el Earn de Coinbase. No lo recomiendo. 👎,2025-04-18 10:00:00
Binance,Smart Chain,negativo,El Smart Chain de Binance no vale lo que cuesta. 😡,2025-04-16 02:00:00
Nike,Nike App,neutral,"Interesante propuesta con Nike App de Nike, veremos cómo evoluciona.",2025-04-17 19:00:00
Nike,Air Max,negativo,"Air Max no sirve para nada, Nike debería hacer recall ya.",2025-04-15 21:00:00
Nike,Air Max,negativo,Nunca volveré a comprar un Air Max de Nike. Estafa total.,2025-04-16 11:00:00
Apple,iPhone 15,positivo,La mejor inversión que he hecho este año es iPhone 15 de Apple. 🔥,2025-04-18 07:00:00
Meta,Oculus Quest,negativo,Tuve una pésima experiencia con Oculus Quest de Meta. Decepcionante. 👎,2025-04-15 09:00:00
Coinbase,Coinbase Pro,neutral,No entiendo el hype con el Coinbase Pro de Coinbase. Meh.,2025-04-17 20:00:00
Nvidia,DLSS 3.5,positivo,"DLSS 3.5 me ha cambiado la vida. Gracias, Nvidia. ❤️",2025-04-17 09:00:00
Tesla,Model Y,positivo,"Tesla se la rifó con el Model Y, está brutal 😍",2025-04-18 12:00:00
Tesla,Autopilot,neutral,"Autopilot cumple con lo básico. Nada sorprendente, pero funciona.",2025-04-20 06:00:00
Nike,Jordan Retro,neutral,Vi muchas reseñas del Jordan Retro de Nike. Opiniones divididas.,2025-04-16 04:00:00
Binance,Smart Chain,neutral,Binance lanzó el nuevo Smart Chain. Alguien ya lo probó?,2025-04-16 15:00:00
Tesla,Autopilot,neutral,Tesla lanzó el nuevo Autopilot. Alguien ya lo probó?,2025-04-17 17:00:00
Nike,Jordan Retro,positivo,¡Amo mi nuevo Jordan Retro de Nike! 🥳,2025-04-19 18:00:00
Meta,Facebook Ads,positivo,El servicio de Meta con Facebook Ads fue impecable. 10/10 ⭐,2025-04-16 13:00:00
Binance,Launchpad,negativo,El soporte de Binance no resolvió nada con mi Launchpad. 🤬,2025-04-15 17:00:00
Binance,Binance App,negativo,"Binance App no sirve para nada, Binance debería hacer recall ya.",2025-04-18 08:00:00
Nvidia,DLSS 3.5,positivo,Nunca pensé que DLSS 3.5 de Nvidia fuera tan bueno. Sorprendido. 👍,2025-04-19 16:00:00
Nvidia,RTX 4090,negativo,Malísimo el RTX 4090 de Nvidia. No lo recomiendo. 👎,2025-04-16 21:00:00
Tesla,Model Y,neutral,Tesla lanzó el nuevo Model Y. Alguien ya lo probó?,2025-04-17 10:00:00
Coinbase,Wallet,negativo,Tuve una pésima experiencia con Wallet de Coinbase. Decepcionante. 👎,2025-04-15 20:00:00
Binance,Smart Chain,positivo,"Smart Chain me ha cambiado la vida. Gracias, Binance. ❤️",2025-04-17 03:00:00
Apple,iOS 18,positivo,Nunca pensé que iOS 18 de Apple fuera tan bueno. Sorprendido. 👍,2025-04-19 02:00:00
Coinbase,Coinbase Pro,neutral,No entiendo el hype con el Coinbase Pro de Coinbase. Meh.,2025-04-16 16:00:00
Nvidia,DLSS 3.5,positivo,El servicio de Nvidia con DLSS 3.5 fue impecable. 10/10 ⭐,2025-04-20 00:00:00
Nike,Air Max,neutral,Probando el Air Max de Nike. Aún no sé qué pensar.,2025-04-18 07:00:00
Nike,Nike Run Club,negativo,Otro día más batallando con Nike Run Club de Nike.,2025-04-18 05:00:00
Tesla,Model 3,neutral,"Es un Model 3 más. No está mal, pero tampoco es la gran cosa.",2025-04-15 21:00:00
Apple,Apple Watch,positivo,No puedo creer lo bien que funciona el Apple Watch de Apple. Recomendado. 💯,2025-04-20 07:00:00
Tesla,Powerwall,positivo,"Desde que uso Powerwall, soy más feliz. Gracias Tesla! 😊",2025-04-18 08:00:00
Apple,MacBook Air,neutral,No tengo quejas ni elogios del MacBook Air de Apple.,2025-04-15 18:00:00
Nike,Nike App,neutral,"Interesante propuesta con Nike App de Nike, veremos cómo evoluciona.",2025-04-18 01:00:00
Coinbase,Wallet,neutral,El Wallet de Coinbase es... aceptable.,2025-04-16 00:00:00
Nike,Air Max,negativo,Nunca volveré a comprar un Air Max de Nike. Estafa total.,2025-04-17 19:00:00
Nike,Nike App,positivo,"Nike App me ha cambiado la vida. Gracias, Nike. ❤️",2025-04-16 04:00:00
Nvidia,GeForce NOW,positivo,Nunca pensé que GeForce NOW de Nvidia fuera tan bueno. Sorprendido. 👍,2025-04-17 06:00:00
Meta,Instagram,negativo,El soporte de Meta no resolvió nada con mi Instagram. 🤬,2025-04-20 04:00:00
Nike,Nike Run Club,neutral,Probando el Nike Run Club de Nike. Aún no sé qué pensar.,2025-04-19 07:00:00
Tesla,Model 3,negativo,El soporte de Tesla no resolvió nada con mi Model 3. 🤬,2025-04-18 11:00:00
Tesla,Model 3,neutral,"Es un Model 3 más. No está mal, pero tampoco es la gran cosa.",2025-04-18 14:00:00
Coinbase,Wallet,neutral,No entiendo el hype con el Wallet de Coinbase. Meh.,2025-04-20 06:00:00
Apple,iOS 18,neutral,Parece estable el iOS 18 de Apple. Veremos con el tiempo.,2025-04-20 04:00:00
Nike,Nike App,positivo,Lo de Nike con el Nike App es otro nivel. 😎,2025-04-17 17:00:00
Nvidia,RTX 4090,neutral,"Interesante propuesta con RTX 4090 de Nvidia, veremos cómo evoluciona.",2025-04-18 00:00:00
Nvidia,CUDA Toolkit,neutral,"CUDA Toolkit cumple con lo básico. Nada sorprendente, pero funciona.",2025-04-20 01:00:00
Apple,MacBook Air,positivo,El servicio de Apple con MacBook Air fue impecable. 10/10 ⭐,2025-04-17 03:00:00
Binance,Binance App,positivo,La mejor inversión que he hecho este año es Binance App de Binance. 🔥,2025-04-18 00:00:00
Meta,Oculus Quest,positivo,El servicio de Meta con Oculus Quest fue impecable. 10/10 ⭐,2025-04-15 13:00:00
Meta,Threads,neutral,Vi muchas reseñas del Threads de Meta. Opiniones divididas.,2025-04-18 23:00:00
Coinbase,NFT platform,positivo,"Desde que uso NFT platform, soy más feliz. Gracias Coinbase! 😊",2025-04-16 13:00:00
Tesla,Model 3,negativo,Nunca volveré a comprar un Model 3 de Tesla. Estafa total.,2025-04-15 22:00:00
Meta,Oculus Quest,negativo,Nunca volveré a comprar un Oculus Quest de Meta. Estafa total.,2025-04-16 16:00:00
Coinbase,Earn,neutral,Probando el Earn de Coinbase. Aún no sé qué pensar.,2025-04-20 07:00:00
Apple,iPhone 15,negativo,"Apple, ¿qué les pasó con el iPhone 15? Está lleno de fallas. 😤",2025-04-16 15:00:00
Tesla,Model Y,negativo,El Model Y de Tesla no vale lo que cuesta. 😡,2025-04-20 03:00:00
Binance,Launchpad,negativo,"Ya van 3 veces que falla el Launchpad. ¿Qué pasa, Binance?",2025-04-20 05:00:00
Meta,Facebook Ads,positivo,"Meta se la rifó con el Facebook Ads, está brutal 😍",2025-04-16 12:00:00
Coinbase,Earn,positivo,"Earn me ha cambiado la vida. Gracias, Coinbase. ❤️",2025-04-15 18:00:00
