empresa,producto,sentimiento,comentario,fecha_hora
Apple,Apple Watch,negativo,"Apple Watch no sirve para nada, Apple debería hacer recall ya.",2025-04-20 03:00:00
Nvidia,GeForce NOW,negativo,Tuve una pésima experiencia con GeForce NOW de Nvidia. Decepcionante. 👎,2025-04-16 08:00:00
Nike,Jordan Retro,neutral,Parece estable el Jordan Retro de Nike. Veremos con el tiempo.,2025-04-18 17:00:00
Apple,iOS 18,neutral,Vi muchas reseñas del iOS 18 de Apple. Opiniones divididas.,2025-04-20 00:00:00
Binance,Earn Program,positivo,Nunca pensé que Earn Program de Binance fuera tan bueno. Sorprendido. 👍,2025-04-19 11:00:00
Meta,Oculus Quest,neutral,Probando el Oculus Quest de Meta. Aún no sé qué pensar.,2025-04-19 01:00:00
Binance,Binance App,positivo,La mejor inversión que he hecho este año es Binance App de Binance. 🔥,2025-04-18 03:00:00
Tesla,Model 3,neutral,No tengo quejas ni elogios del Model 3 de Tesla.,2025-04-15 21:00:00
Nike,Nike Run Club,positivo,La mejor inversión que he hecho este año es Nike Run Club de Nike. 🔥,2025-04-18 05:00:00
Nvidia,GeForce NOW,neutral,"Es un GeForce NOW más. No está mal, pero tampoco es la gran cosa.",2025-04-16 01:00:00
Coinbase,Earn,positivo,"Earn me ha cambiado la vida. Gracias, Coinbase. ❤️",2025-04-18 08:00:00
Apple,MacBook Air,positivo,Lo de Apple con el MacBook Air es otro nivel. 😎,2025-04-15 17:00:00
Meta,Oculus Quest,negativo,El Oculus Quest de Meta no vale lo que cuesta. 😡,2025-04-19 19:00:00
Nike,Jordan Retro,negativo,Nunca volveré a comprar un Jordan Retro de Nike. Estafa total.,2025-04-18 11:00:00
Tesla,Model Y,negativo,Tuve una pésima experiencia con Model Y de Tesla. Decepcionante. 👎,2025-04-17 02:00:00
Nike,Nike Run Club,positivo,"Nike se la rifó con el Nike Run Club, está brutal 😍",2025-04-17 15:00:00
Nike,Air Max,neutral,"Interesante propuesta con Air Max de Nike, veremos cómo evoluciona.",2025-04-18 09:00:00
Tesla,Model Y,positivo,Lo de Tesla con el Model Y es otro nivel. 😎,2025-04-16 09:00:00
Tesla,Autopilot,negativo,"Autopilot no sirve para nada, Tesla debería hacer recall ya.",2025-04-16 05:00:00
Tesla,Model 3,neutral,"Model 3 cumple con lo básico. Nada sorprendente, pero funciona.",2025-04-16 20:00:00
Nike,Jordan Retro,negativo,Otro día más batallando con Jordan Retro de Nike.,2025-04-20 02:00:00
Binance,Earn Program,neutral,Binance lanzó el nuevo Earn Program. Alguien ya lo probó?,2025-04-19 05:00:00
Meta,Instagram,neutral,Meta lanzó el nuevo Instagram. Alguien ya lo probó?,2025-04-17 17:00:00
Apple,iPhone 15,negativo,Nunca volveré a comprar un iPhone 15 de Apple. Estafa total.,2025-04-18 20:00:00
Nvidia,RTX 4090,neutral,Probando el RTX 4090 de Nvidia. Aún no sé qué pensar.,2025-04-16 22:00:00
Nike,Jordan Retro,neutral,Vi muchas reseñas del Jordan Retro de Nike. Opiniones divididas.,2025-04-15 13:00:00
Binance,Binance App,negativo,"Ya van 3 veces que falla el Binance App. ¿Qué pasa, Binance?",2025-04-19 19:00:00
Meta,Instagram,negativo,Nunca volveré a comprar un Instagram de Meta. Estafa total.,2025-04-20 05:00:00
Tesla,Model 3,neutral,"Interesante propuesta con Model 3 de Tesla, veremos cómo evoluciona.",2025-04-19 05:00:00
Binance,Smart Chain,negativo,Tuve una pésima experiencia con Smart Chain de Binance. Decepcionante. 👎,2025-04-18 18:00:00
Nike,Nike App,positivo,Lo de Nike con el Nike App es otro nivel. 😎,2025-04-17 21:00:00
Nvidia,DLSS 3.5,positivo,"Nvidia se la rifó con el DLSS 3.5, está brutal 😍",2025-04-19 15:00:00
Meta,Oculus Quest,negativo,"Ya van 3 veces que falla el Oculus Quest. ¿Qué pasa, Meta?",2025-04-20 08:00:00
Apple,MacBook Air,negativo,Malísimo el MacBook Air de Apple. No lo recomiendo. 👎,2025-04-15 17:00:00
Nike,Air Max,neutral,Probando el Air Max de Nike. Aún no sé qué pensar.,2025-04-15 08:00:00
Nike,Nike Run Club,neutral,Parece estable el Nike Run Club de Nike. Veremos con el tiempo.,2025-04-20 04:00:00
Nike,Nike App,negativo,He tenido más problemas que beneficios con el Nike App de Nike.,2025-04-15 12:00:00
Nvidia,DLSS 3.5,positivo,No puedo creer lo bien que funciona el DLSS 3.5 de Nvidia. Recomendado. 💯,2025-04-18 02:00:00
Nike,Air Max,neutral,El Air Max de Nike es... aceptable.,2025-04-18 01:00:00
Binance,Binance App,neutral,Binance lanzó el nuevo Binance App. Alguien ya lo probó?,2025-04-19 04:00:00
Binance,Smart Chain,negativo,El Smart Chain de Binance no vale lo que cuesta. 😡,2025-04-16 09:00:00
Apple,iOS 18,neutral,El iOS 18 de Apple es... aceptable.,2025-04-15 15:00:00
Meta,Instagram,positivo,Nunca pensé que Instagram de Meta fuera tan bueno. Sorprendido. 👍,2025-04-16 09:00:00
Coinbase,Coinbase Pro,neutral,"Coinbase Pro cumple con lo básico. Nada sorprendente, pero funciona.",2025-04-18 12:00:00
Meta,Threads,neutral,Vi muchas reseñas del Threads de Meta. Opiniones divididas.,2025-04-16 11:00:00
Nvidia,GeForce NOW,positivo,"GeForce NOW me ha cambiado la vida. Gracias, Nvidia. ❤️",2025-04-19 17:00:00
Nvidia,CUDA Toolkit,positivo,"CUDA Toolkit me ha cambiado la vida. Gracias, Nvidia. ❤️",2025-04-16 02:00:00
Nike,Air Max,negativo,Tuve una pésima experiencia con Air Max de Nike. Decepcionante. 👎,2025-04-19 19:00:00
Binance,Earn Program,positivo,La mejor inversión que he hecho este año es Earn Program de Binance. 🔥,2025-04-18 14:00:00
Binance,Earn Program,neutral,"Es un Earn Program más. No está mal, pero tampoco es la gran cosa.",2025-04-19 16:00:00
Binance,Binance App,negativo,Tuve una pésima experiencia con Binance App de Binance. Decepcionante. 👎,2025-04-17 06:00:00
Meta,Threads,negativo,"Meta, ¿qué les pasó con el Threads? Está lleno de fallas. 😤",2025-04-17 12:00:00
Nike,Air Max,neutral,"Air Max cumple con lo básico. Nada sorprendente, pero funciona.",2025-04-16 01:00:00
Nvidia,GeForce NOW,negativo,"GeForce NOW no sirve para nada, Nvidia debería hacer recall ya.",2025-04-17 19:00:00
Nvidia,DLSS 3.5,negativo,Tuve una pésima experiencia con DLSS 3.5 de Nvidia. Decepcionante. 👎,2025-04-15 15:00:00
Tesla,Powerwall,neutral,Parece estable el Powerwall de Tesla. Veremos con el tiempo.,2025-04-18 22:00:00
Apple,Apple Watch,positivo,¡Amo mi nuevo Apple Watch de Apple! 🥳,2025-04-16 03:00:00
Apple,iPhone 15,negativo,Tuve una pésima experiencia con iPhone 15 de Apple. Decepcionante. 👎,2025-04-16 13:00:00
Nvidia,DLSS 3.5,positivo,"Nvidia se la rifó con el DLSS 3.5, está brutal 😍",2025-04-16 22:00:00
Binance,Smart Chain,neutral,No entiendo el hype con el Smart Chain de Binance. Meh.,2025-04-19 10:00:00
Nike,Air Max,positivo,Muy satisfecho con Air Max de Nike. No esperaba menos.,2025-04-18 23:00:00
Coinbase,Wallet,negativo,Malísimo el Wallet de Coinbase. No lo recomiendo. 👎,2025-04-17 11:00:00
Meta,Oculus Quest,negativo,"Oculus Quest no sirve para nada, Meta debería hacer recall ya.",2025-04-19 19:00:00
Nike,Nike App,neutral,Vi muchas reseñas del Nike App de Nike. Opiniones divididas.,2025-04-16 19:00:00
Nike,Nike App,negativo,El soporte de Nike no resolvió nada con mi Nike App. 🤬,2025-04-19 13:00:00
Nike,Jordan Retro,negativo,Malísimo el Jordan Retro de Nike. No lo recomiendo. 👎,2025-04-15 08:00:00
Nvidia,CUDA Toolkit,neutral,Probando el CUDA Toolkit de Nvidia. Aún no sé qué pensar.,2025-04-16 06:00:00
Nike,Jordan Retro,positivo,No puedo creer lo bien que funciona el Jordan Retro de Nike. Recomendado. 💯,2025-04-20 00:00:00
Nvidia,CUDA Toolkit,positivo,Muy satisfecho con CUDA Toolkit de Nvidia. No esperaba menos.,2025-04-17 10:00:00
Nvidia,DLSS 3.5,neutral,No entiendo el hype con el DLSS 3.5 de Nvidia. Meh.,2025-04-16 02:00:00
Meta,Facebook Ads,neutral,Probando el Facebook Ads de Meta. Aún no sé qué pensar.,2025-04-18 16:00:00
Nvidia,GeForce NOW,neutral,No tengo quejas ni elogios del GeForce NOW de Nvidia.,2025-04-18 15:00:00
Nike,Nike App,negativo,He tenido más problemas que beneficios con el Nike App de Nike.,2025-04-19 07:00:00
Meta,Threads,negativo,Nunca volveré a comprar un Threads de Meta. Estafa total.,2025-04-16 11:00:00
Nike,Nike Run Club,negativo,El Nike Run Club de Nike no vale lo que cuesta. 😡,2025-04-17 16:00:00
Binance,Launchpad,positivo,Lo de Binance con el Launchpad es otro nivel. 😎,2025-04-19 00:00:00
Binance,Earn Program,negativo,Otro día más batallando con Earn Program de Binance.,2025-04-15 13:00:00
Nvidia,RTX 4090,negativo,El soporte de Nvidia no resolvió nada con mi RTX 4090. 🤬,2025-04-17 13:00:00
Tesla,Model 3,negativo,"Ya van 3 veces que falla el Model 3. ¿Qué pasa, Tesla?",2025-04-18 23:00:00
Coinbase,Wallet,negativo,"Ya van 3 veces que falla el Wallet. ¿Qué pasa, Coinbase?",2025-04-15 23:00:00
Meta,Facebook Ads,negativo,Malísimo el Facebook Ads de Meta. No lo recomiendo. 👎,2025-04-17 04:00:00
Nvidia,DLSS 3.5,neutral,Probando el DLSS 3.5 de Nvidia. Aún no sé qué pensar.,2025-04-19 10:00:00
Tesla,Model Y,negativo,"Tesla, ¿qué les pasó con el Model Y? Está lleno de fallas. 😤",2025-04-18 16:00:00
Nvidia,CUDA Toolkit,negativo,Otro día más batallando con CUDA Toolkit de Nvidia.,2025-04-16 14:00:00
Coinbase,Earn,positivo,Muy satisfecho con Earn de Coinbase. No esperaba menos.,2025-04-15 19:00:00
Meta,Oculus Quest,neutral,No tengo quejas ni elogios del Oculus Quest de Meta.,2025-04-18 09:00:00
Apple,Apple Watch,negativo,El Apple Watch de Apple no vale lo que cuesta. 😡,2025-04-18 22:00:00
Apple,iOS 18,positivo,La mejor inversión que he hecho este año es iOS 18 de Apple. 🔥,2025-04-20 04:00:00
Apple,iPhone 15,positivo,El servicio de Apple con iPhone 15 fue impecable. 10/10 ⭐,2025-04-19 08:00:00
Apple,MacBook Air,negativo,"Apple, ¿qué les pasó con el MacBook Air? Está lleno de fallas. 😤",2025-04-19 05:00:00
Nike,Nike Run Club,negativo,Nunca volveré a comprar un Nike Run Club de Nike. Estafa total.,2025-04-20 02:00:00
Nvidia,DLSS 3.5,positivo,Muy satisfecho con DLSS 3.5 de Nvidia. No esperaba menos.,2025-04-19 02:00:00
Binance,Earn Program,positivo,No puedo creer lo bien que funciona el Earn Program de Binance. Recomendado. 💯,2025-04-16 21:00:00
Tesla,Autopilot,neutral,"Interesante propuesta con Autopilot de Tesla, veremos cómo evoluciona.",2025-04-16 08:00:00
Meta,Oculus Quest,positivo,¡Amo mi nuevo Oculus Quest de Meta! 🥳,2025-04-17 10:00:00
Meta,Facebook Ads,positivo,"Meta se la rifó con el Facebook Ads, está brutal 😍",2025-04-19 16:00:00
Tesla,Model Y,positivo,Muy satisfecho con Model Y de Tesla. No esperaba menos.,2025-04-20 05:00:00
Meta,Threads,neutral,El Threads de Meta es... aceptable.,2025-04-15 22:00:00
Nvidia,GeForce NOW,positivo,"Nvidia se la rifó con el GeForce NOW, está brutal 😍",2025-04-16 07:00:00
Nike,Jordan Retro,positivo,Lo de Nike con el Jordan Retro es otro nivel. 😎,2025-04-19 05:00:00
Tesla,Powerwall,positivo,El servicio de Tesla con Powerwall fue impecable. 10/10 ⭐,2025-04-19 21:00:00
Nvidia,DLSS 3.5,neutral,No tengo quejas ni elogios del DLSS 3.5 de Nvidia.,2025-04-19 18:00:00
Nike,Nike App,positivo,Lo de Nike con el Nike App es otro nivel. 😎,2025-04-19 11:00:00
Tesla,Model 3,neutral,Parece estable el Model 3 de Tesla. Veremos con el tiempo.,2025-04-16 04:00:00
Nvidia,CUDA Toolkit,neutral,Parece estable el CUDA Toolkit de Nvidia. Veremos con el tiempo.,2025-04-18 04:00:00
Coinbase,NFT platform,positivo,Lo de Coinbase con el NFT platform es otro nivel. 😎,2025-04-15 14:00:00
Tesla,Autopilot,positivo,"Tesla se la rifó con el Autopilot, está brutal 😍",2025-04-19 22:00:00
Nvidia,CUDA Toolkit,positivo,¡Amo mi nuevo CUDA Toolkit de Nvidia! 🥳,2025-04-19 12:00:00
Coinbase,Wallet,negativo,Otro día más batallando con Wallet de Coinbase.,2025-04-16 02:00:00
Binance,Smart Chain,negativo,Otro día más batallando con Smart Chain de Binance.,2025-04-19 23:00:00
Coinbase,Wallet,neutral,Parece estable el Wallet de Coinbase. Veremos con el tiempo.,2025-04-17 12:00:00
Coinbase,Coinbase Pro,negativo,"Coinbase Pro no sirve para nada, Coinbase debería hacer recall ya.",2025-04-15 08:00:00
Nvidia,GeForce NOW,negativo,Nunca volveré a comprar un GeForce NOW de Nvidia. Estafa total.,2025-04-19 22:00:00
Coinbase,Wallet,negativo,Otro día más batallando con Wallet de Coinbase.,2025-04-18 09:00:00
Apple,Apple Watch,positivo,"Desde que uso Apple Watch, soy más feliz. Gracias Apple! 😊",2025-04-17 10:00:00
Binance,Launchpad,negativo,"Launchpad no sirve para nada, Binance debería hacer recall ya.",2025-04-16 23:00:00
Nvidia,CUDA Toolkit,negativo,El CUDA Toolkit de Nvidia no vale lo que cuesta. 😡,2025-04-18 20:00:00
Meta,Facebook Ads,neutral,"Interesante propuesta con Facebook Ads de Meta, veremos cómo evoluciona.",2025-04-15 16:00:00
Meta,Threads,positivo,¡Amo mi nuevo Threads de Meta! 🥳,2025-04-17 01:00:00
Nike,Nike App,positivo,Nunca pensé que Nike App de Nike fuera tan bueno. Sorprendido. 👍,2025-04-18 22:00:00
Coinbase,Coinbase Pro,neutral,Parece estable el Coinbase Pro de Coinbase. Veremos con el tiempo.,2025-04-16 15:00:00
Meta,Oculus Quest,neutral,Vi muchas reseñas del Oculus Quest de Meta. Opiniones divididas.,2025-04-18 05:00:00
Binance,Smart Chain,neutral,El Smart Chain de Binance es... aceptable.,2025-04-17 04:00:00
Nike,Nike App,positivo,"Nike se la rifó con el Nike App, está brutal 😍",2025-04-20 06:00:00
Coinbase,Earn,positivo,Lo de Coinbase con el Earn es otro nivel. 😎,2025-04-17 19:00:00
Meta,Facebook Ads,positivo,Muy satisfecho con Facebook Ads de Meta. No esperaba menos.,2025-04-16 10:00:00
Binance,Launchpad,negativo,He tenido más problemas que beneficios con el Launchpad de Binance.,2025-04-16 19:00:00
Coinbase,Coinbase Pro,positivo,La mejor inversión que he hecho este año es Coinbase Pro de Coinbase. 🔥,2025-04-15 18:00:00
Meta,Threads,neutral,No tengo quejas ni elogios del Threads de Meta.,2025-04-17 04:00:00
Meta,Facebook Ads,neutral,Parece estable el Facebook Ads de Meta. Veremos con el tiempo.,2025-04-16 02:00:00
Meta,Instagram,positivo,¡Amo mi nuevo Instagram de Meta! 🥳,2025-04-16 11:00:00
Meta,Facebook Ads,negativo,"Meta, ¿qué les pasó con el Facebook Ads? Está lleno de fallas. 😤",2025-04-17 03:00:00
Nvidia,DLSS 3.5,neutral,No entiendo el hype con el DLSS 3.5 de Nvidia. Meh.,2025-04-18 02:00:00
Tesla,Powerwall,positivo,"Tesla se la rifó con el Powerwall, está brutal 😍",2025-04-19 04:00:00
Coinbase,NFT platform,negativo,Tuve una pésima experiencia con NFT platform de Coinbase. Decepcionante. 👎,2025-04-18 06:00:00
Nike,Jordan Retro,positivo,La mejor inversión que he hecho este año es Jordan Retro de Nike. 🔥,2025-04-16 13:00:00
Binance,Smart Chain,neutral,Probando el Smart Chain de Binance. Aún no sé qué pensar.,2025-04-15 20:00:00
Nike,Nike Run Club,positivo,La mejor inversión que he hecho este año es Nike Run Club de Nike. 🔥,2025-04-16 00:00:00
Nvidia,GeForce NOW,positivo,Nunca pensé que GeForce NOW de Nvidia fuera tan bueno. Sorprendido. 👍,2025-04-16 16:00:00
Nvidia,DLSS 3.5,negativo,Tuve una pésima experiencia con DLSS 3.5 de Nvidia. Decepcionante. 👎,2025-04-20 01:00:00
Apple,Apple Watch,positivo,Muy satisfecho con Apple Watch de Apple. No esperaba menos.,2025-04-17 11:00:00
Tesla,Model Y,neutral,"Model Y cumple con lo básico. Nada sorprendente, pero funciona.",2025-04-17 17:00:00
Binance,Binance App,positivo,La mejor inversión que he hecho este año es Binance App de Binance. 🔥,2025-04-17 20:00:00
Nike,Jordan Retro,negativo,"Nike, ¿qué les pasó con el Jordan Retro? Está lleno de fallas. 😤",2025-04-17 14:00:00
Meta,Oculus Quest,neutral,Vi muchas reseñas del Oculus Quest de Meta. Opiniones divididas.,2025-04-19 03:00:00
Coinbase,Earn,neutral,"Es un Earn más. No está mal, pero tampoco es la gran cosa.",2025-04-19 23:00:00
Apple,Apple Watch,positivo,"Apple se la rifó con el Apple Watch, está brutal 😍",2025-04-19 00:00:00
Nike,Jordan Retro,neutral,"Jordan Retro cumple con lo básico. Nada sorprendente, pero funciona.",2025-04-17 14:00:00
Binance,Smart Chain,positivo,"Smart Chain me ha cambiado la vida. Gracias, Binance. ❤️",2025-04-17 21:00:00
Nvidia,RTX 4090,neutral,Nvidia lanzó el nuevo RTX 4090. Alguien ya lo probó?,2025-04-18 20:00:00
Nvidia,GeForce NOW,negativo,Nunca volveré a comprar un GeForce NOW de Nvidia. Estafa total.,2025-04-18 21:00:00
Coinbase,Coinbase Pro,positivo,La mejor inversión que he hecho este año es Coinbase Pro de Coinbase. 🔥,2025-04-17 19:00:00
Tesla,Powerwall,positivo,"Desde que uso Powerwall, soy más feliz. Gracias Tesla! 😊",2025-04-16 17:00:00
Coinbase,NFT platform,neutral,"Es un NFT platform más. No está mal, pero tampoco es la gran cosa.",2025-04-16 18:00:00
Nike,Nike App,positivo,No puedo creer lo bien que funciona el Nike App de Nike. Recomendado. 💯,2025-04-20 07:00:00
Meta,Oculus Quest,positivo,¡Amo mi nuevo Oculus Quest de Meta! 🥳,2025-04-17 14:00:00
Apple,Apple Watch,negativo,Malísimo el Apple Watch de Apple. No lo recomiendo. 👎,2025-04-20 04:00:00
Nike,Nike App,neutral,Parece estable el Nike App de Nike. Veremos con el tiempo.,2025-04-20 02:00:00
Meta,Threads,neutral,Vi muchas reseñas del Threads de Meta. Opiniones divididas.,2025-04-15 12:00:00
Nvidia,GeForce NOW,positivo,Nunca pensé que GeForce NOW de Nvidia fuera tan bueno. Sorprendido. 👍,2025-04-17 06:00:00
Coinbase,Coinbase Pro,negativo,"Coinbase, ¿qué les pasó con el Coinbase Pro? Está lleno de fallas. 😤",2025-04-20 01:00:00
Coinbase,Earn,positivo,Nunca pensé que Earn de Coinbase fuera tan bueno. Sorprendido. 👍,2025-04-17 14:00:00
Coinbase,Wallet,negativo,He tenido más problemas que beneficios con el Wallet de Coinbase.,2025-04-19 11:00:00
Binance,Smart Chain,negativo,"Ya van 3 veces que falla el Smart Chain. ¿Qué pasa, Binance?",2025-04-18 06:00:00
Apple,iOS 18,neutral,No entiendo el hype con el iOS 18 de Apple. Meh.,2025-04-18 11:00:00
Apple,MacBook Air,positivo,No puedo creer lo bien que funciona el MacBook Air de Apple. Recomendado. 💯,2025-04-16 19:00:00
Meta,Instagram,negativo,Malísimo el Instagram de Meta. No lo recomiendo. 👎,2025-04-18 06:00:00
Nike,Jordan Retro,negativo,Otro día más batallando con Jordan Retro de Nike.,2025-04-18 16:00:00
Tesla,Powerwall,positivo,"Desde que uso Powerwall, soy más feliz. Gracias Tesla! 😊",2025-04-20 08:00:00
Tesla,Autopilot,negativo,Tuve una pésima experiencia con Autopilot de Tesla. Decepcionante. 👎,2025-04-15 17:00:00
Nike,Nike App,neutral,No tengo quejas ni elogios del Nike App de Nike.,2025-04-16 04:00:00
Binance,Launchpad,negativo,Nunca volveré a comprar un Launchpad de Binance. Estafa total.,2025-04-18 02:00:00
Coinbase,Coinbase Pro,positivo,Lo de Coinbase con el Coinbase Pro es otro nivel. 😎,2025-04-19 06:00:00
Nike,Nike Run Club,neutral,No entiendo el hype con el Nike Run Club de Nike. Meh.,2025-04-19 09:00:00
Coinbase,Wallet,neutral,Coinbase lanzó el nuevo Wallet. Alguien ya lo probó?,2025-04-20 06:00:00
Binance,Earn Program,neutral,"Earn Program cumple con lo básico. Nada sorprendente, pero funciona.",2025-04-17 02:00:00
Tesla,Autopilot,neutral,"Interesante propuesta con Autopilot de Tesla, veremos cómo evoluciona.",2025-04-19 06:00:00
Nike,Jordan Retro,neutral,Parece estable el Jordan Retro de Nike. Veremos con el tiempo.,2025-04-20 05:00:00
Tesla,Autopilot,neutral,Tesla lanzó el nuevo Autopilot. Alguien ya lo probó?,2025-04-19 18:00:00
Tesla,Powerwall,neutral,"Es un Powerwall más. No está mal, pero tampoco es la gran cosa.",2025-04-18 07:00:00
Coinbase,Earn,positivo,Muy satisfecho con Earn de Coinbase. No esperaba menos.,2025-04-16 06:00:00
Coinbase,Coinbase Pro,neutral,Vi muchas reseñas del Coinbase Pro de Coinbase. Opiniones divididas.,2025-04-15 18:00:00
Apple,iOS 18,negativo,"Ya van 3 veces que falla el iOS 18. ¿Qué pasa, Apple?",2025-04-19 15:00:00
Meta,Instagram,neutral,No entiendo el hype con el Instagram de Meta. Meh.,2025-04-17 15:00:00
Tesla,Powerwall,neutral,El Powerwall de Tesla es... aceptable.,2025-04-18 09:00:00
Nvidia,GeForce NOW,positivo,No puedo creer lo bien que funciona el GeForce NOW de Nvidia. Recomendado. 💯,2025-04-16 04:00:00
Meta,Threads,negativo,El soporte de Meta no resolvió nada con mi Threads. 🤬,2025-04-20 05:00:00
Apple,iOS 18,negativo,Tuve una pésima experiencia con iOS 18 de Apple. Decepcionante. 👎,2025-04-20 05:00:00
Binance,Launchpad,positivo,¡Amo mi nuevo Launchpad de Binance! 🥳,2025-04-15 21:00:00
Coinbase,Wallet,neutral,El Wallet de Coinbase es... aceptable.,2025-04-20 05:00:00
Binance,Launchpad,neutral,No tengo quejas ni elogios del Launchpad de Binance.,2025-04-16 23:00:00
Nike,Jordan Retro,neutral,"Jordan Retro cumple con lo básico. Nada sorprendente, pero funciona.",2025-04-18 20:00:00
Coinbase,Wallet,neutral,"Es un Wallet más. No está mal, pero tampoco es la gran cosa.",2025-04-19 21:00:00
Apple,Apple Watch,neutral,"Apple Watch cumple con lo básico. Nada sorprendente, pero funciona.",2025-04-18 07:00:00
Coinbase,NFT platform,negativo,Nunca volveré a comprar un NFT platform de Coinbase. Estafa total.,2025-04-17 16:00:00
Apple,MacBook Air,positivo,¡Amo mi nuevo MacBook Air de Apple! 🥳,2025-04-15 21:00:00
Apple,MacBook Air,neutral,Vi muchas reseñas del MacBook Air de Apple. Opiniones divididas.,2025-04-19 07:00:00
Nvidia,CUDA Toolkit,positivo,Nunca pensé que CUDA Toolkit de Nvidia fuera tan bueno. Sorprendido. 👍,2025-04-16 21:00:00
Binance,Smart Chain,neutral,El Smart Chain de Binance es... aceptable.,2025-04-19 17:00:00
Binance,Earn Program,neutral,Vi muchas reseñas del Earn Program de Binance. Opiniones divididas.,2025-04-18 04:00:00
Meta,Facebook Ads,negativo,El Facebook Ads de Meta no vale lo que cuesta. 😡,2025-04-19 14:00:00
Tesla,Model Y,negativo,Otro día más batallando con Model Y de Tesla.,2025-04-19 11:00:00
Apple,iOS 18,neutral,No tengo quejas ni elogios del iOS 18 de Apple.,2025-04-19 10:00:00
Nike,Jordan Retro,neutral,Vi muchas reseñas del Jordan Retro de Nike. Opiniones divididas.,2025-04-15 08:00:00
Coinbase,Wallet,positivo,El servicio de Coinbase con Wallet fue impecable. 10/10 ⭐,2025-04-17 15:00:00
Apple,Apple Watch,negativo,Malísimo el Apple Watch de Apple. No lo recomiendo. 👎,2025-04-18 00:00:00
Nvidia,GeForce NOW,negativo,Tuve una pésima experiencia con GeForce NOW de Nvidia. Decepcionante. 👎,2025-04-19 05:00:00
Apple,iOS 18,negativo,El iOS 18 de Apple no vale lo que cuesta. 😡,2025-04-17 09:00:00
Binance,Smart Chain,neutral,"Es un Smart Chain más. No está mal, pero tampoco es la gran cosa.",2025-04-15 19:00:00
Apple,iOS 18,negativo,El soporte de Apple no resolvió nada con mi iOS 18. 🤬,2025-04-17 01:00:00
Nike,Jordan Retro,positivo,"Desde que uso Jordan Retro, soy más feliz. Gracias Nike! 😊",2025-04-17 19:00:00
Meta,Oculus Quest,neutral,Vi muchas reseñas del Oculus Quest de Meta. Opiniones divididas.,2025-04-18 01:00:00
Coinbase,NFT platform,neutral,"Interesante propuesta con NFT platform de Coinbase, veremos cómo evoluciona.",2025-04-20 04:00:00
Coinbase,Coinbase Pro,negativo,"Ya van 3 veces que falla el Coinbase Pro. ¿Qué pasa, Coinbase?",2025-04-16 20:00:00
Apple,Apple Watch,neutral,Probando el Apple Watch de Apple. Aún no sé qué pensar.,2025-04-16 19:00:00
Nike,Nike Run Club,negativo,El Nike Run Club de Nike no vale lo que cuesta. 😡,2025-04-19 21:00:00
Tesla,Model Y,negativo,Tuve una pésima experiencia con Model Y de Tesla. Decepcionante. 👎,2025-04-16 07:00:00
Binance,Earn Program,neutral,"Interesante propuesta con Earn Program de Binance, veremos cómo evoluciona.",2025-04-18 13:00:00
Meta,Instagram,negativo,Malísimo el Instagram de Meta. No lo recomiendo. 👎,2025-04-17 18:00:00
Binance,Smart Chain,positivo,"Binance se la rifó con el Smart Chain, está brutal 😍",2025-04-16 16:00:00
Binance,Earn Program,neutral,Probando el Earn Program de Binance. Aún no sé qué pensar.,2025-04-19 20:00:00
Nike,Nike Run Club,positivo,Lo de Nike con el Nike Run Club es otro nivel. 😎,2025-04-16 01:00:00
Apple,Apple Watch,neutral,Vi muchas reseñas del Apple Watch de Apple. Opiniones divididas.,2025-04-15 19:00:00
Nike,Jordan Retro,positivo,"Jordan Retro me ha cambiado la vida. Gracias, Nike. ❤️",2025-04-16 23:00:00
Nvidia,DLSS 3.5,negativo,He tenido más problemas que beneficios con el DLSS 3.5 de Nvidia.,2025-04-16 19:00:00
Meta,Facebook Ads,neutral,No entiendo el hype con el Facebook Ads de Meta. Meh.,2025-04-18 18:00:00
Binance,Binance App,neutral,"Interesante propuesta con Binance App de Binance, veremos cómo evoluciona.",2025-04-19 04:00:00
Meta,Threads,positivo,"Threads me ha cambiado la vida. Gracias, Meta. ❤️",2025-04-18 11:00:00
Nike,Air Max,neutral,Nike lanzó el nuevo Air Max. Alguien ya lo probó?,2025-04-15 12:00:00
Binance,Launchpad,neutral,No tengo quejas ni elogios del Launchpad de Binance.,2025-04-19 01:00:00
Meta,Oculus Quest,positivo,"Meta se la rifó con el Oculus Quest, está brutal 😍",2025-04-16 21:00:00
Nvidia,RTX 4090,positivo,No puedo creer lo bien que funciona el RTX 4090 de Nvidia. Recomendado. 💯,2025-04-15 14:00:00
Apple,iOS 18,positivo,"Apple se la rifó con el iOS 18, está brutal 😍",2025-04-20 01:00:00
Nike,Jordan Retro,positivo,El servicio de Nike con Jordan Retro fue impecable. 10/10 ⭐,2025-04-19 10:00:00
Apple,Apple Watch,negativo,"Apple, ¿qué les pasó con el Apple Watch? Está lleno de fallas. 😤",2025-04-18 19:00:00
Meta,Threads,positivo,"Meta se la rifó con el Threads, está brutal 😍",2025-04-18 08:00:00
Nvidia,CUDA Toolkit,positivo,"Nvidia se la rifó con el CUDA Toolkit, está brutal 😍",2025-04-20 01:00:00
Tesla,Powerwall,positivo,Nunca pensé que Powerwall de Tesla fuera tan bueno. Sorprendido. 👍,2025-04-18 15:00:00
Binance,Launchpad,neutral,El Launchpad de Binance es... aceptable.,2025-04-18 12:00:00
Binance,Binance App,negativo,Tuve una pésima experiencia con Binance App de Binance. Decepcionante. 👎,2025-04-16 11:00:00
Coinbase,NFT platform,neutral,Vi muchas reseñas del NFT platform de Coinbase. Opiniones divididas.,2025-04-20 08:00:00
